Gawad Urian Award,23,Boots Anson-Roa, Cherry Pie Picache, Cinema of the Philippines, FAMAS Award, Gina Alajar, Gina Pareño, List of Philippine co-produced films and television series, List of Philippine films before 1940, List of Philippine films of the 1940s, List of Philippine films of the 1950s, List of Philippine films of the 1960s, List of Philippine films of the 1970s, List of Philippine films of the 1980s, List of Philippine films of the 1990s, List of Philippine films of the 2010s, List of Philippine submissions for the Academy Award for Best International Feature Film, List of highest-grossing films in the Philippines, List of people who won the Philippine movie grand slam, Lists of Philippine films, Luna Award, Philippines, Vilma Santos, Young Critics Circle, 
Armida Siguion-Reyna,3,Alma Moreno, Dawn Zulueta, Vilma Santos, 
Alex Gonzaga,12,Angeline Quinto, Babaeng Hampaslupa, Ivana Alawi, Jane Oineza, Kylie Verzosa, Melai Cantiveros, Music of the Philippines, Philippines, Pinoy Big Brother: Otso, Pure Love (2014 TV series), Solenn Heussaff, Xian Lim, 
Tiya Pusit,2,Nova Villa, Philippines, 
Nang Ngumiti ang Langit,6,Ces Quesada, Gwen Zamora, Jennica Garcia, Matet de Leon, Shaina Magdayao, Tetchie Agbayani, 
Dulce (Filipino singer),3,It's Showtime (Philippine TV program), Lorna Tolentino, Tawag ng Tanghalan, 
Ian Galliguez,3,G-mik, Joyce Jimenez, Philippines, 
Isabelle de Leon,5,Bea Binene, Diana Zubiri, FAMAS Award, Louise delos Reyes, Maricar de Mesa, 
Alessandra De Rossi,2,Arci Muñoz, Filipinos, 
Niña Jose,41,Aleck Bovick, Ann Li, Barbie Imperial, Bea Saw, Beauty Gonzalez, Cassandra Ponti, Dionne Monsanto, Elisse Joson, Fretzie Bercede, Gaby Dela Merced, Gee-Ann Abrahan, Gerald Anderson, Heaven Peralejo, Jane Oineza, Jinri Park, Kaori Oinuma, Kisses Delavin, Maymay Entrata, Megan Young, Melai Cantiveros, Mich Dulce, Miho Nishida, Myrtle Sarrosa, Nene Tamayo, Nicole Uysiuseng, Philippines, Pinoy Big Brother: Otso, Pinoy Big Brother: Season 1, Pinoy Big Brother: Season 2, Pinoy Big Brother: Teen Clash 2010, Riza Santos, Roxanne Barcelo, Sam Pinto, Seth Fedelin, Valerie Weigmann, Vickie Rushton, Vivoree Esclito, Wendy Valdez, Yayo Aguila, Yen Santos, Ylona Garcia, 
Kim Molina,7,Aicelle Santos, Andi Eigenmann, Arci Muñoz, Camp Sawi, It's Showtime (Philippine TV program), Jennylyn Mercado, Sarah Geronimo, 
Lillet,0,
Marlene Daudén,37,Ai-Ai delas Alas, Aleck Bovick, Amalia Fuentes, Andi Eigenmann, Angelica Panganiban, Anita Linda, Anne Curtis, Ara Mina, Barbara Perez, Boots Anson-Roa, Carmen Rosales, Celia Rodriguez, Charito Solis, Cinema of the Philippines, Claudine Barretto, Dawn Zulueta, Dina Bonnevie, Elizabeth Oropesa, Gloria Romero (actress), Gloria Sevilla, Janine Gutierrez, Judy Ann Santos, KC Concepcion, Lolita Rodriguez, Lorna Tolentino, Lovi Poe, Nadine Lustre, Nena Cardenas, Nida Blanca, Paraluman, Perla Bautista, Philippines, Rosa Rosal, Sharon Cuneta, Snooky Serna, Vilma Santos, Vivian Velez, 
List of Philippine films of 2014,81,1984 in the Philippines, Alex Gonzaga, Andi Eigenmann, Andrea del Rosario, Angelica Panganiban, Angeline Quinto, Anne Curtis, Barbie Forteza, Boots Anson-Roa, Carla Abellana, Cinema of the Philippines, Cris Villonco, Denise Laurel, Dennis Padilla, Elizabeth Oropesa, Ella Cruz, Ellen Adarna, Eugene Domingo, Eula Valdez, Gladys Reyes, Gloria Sevilla, Gretchen Barretto, Irma Adlawan, Isabel Oli, Jaclyn Jose, Jasmine Curtis-Smith, Jean Garcia, Jennylyn Mercado, Jessy Mendiola, Jodi Sta. Maria, Judy Ann Santos, Karla Estrada, Kiray, Kris Aquino, Lauren Young, Laurice Guillen, List of Philippine films before 1940, List of Philippine films of 2011, List of Philippine films of 2012, List of Philippine films of 2013, List of Philippine films of 2015, List of Philippine films of 2016, List of Philippine films of 2017, List of Philippine films of 2018, List of Philippine films of 2019, List of Philippine films of 2020, List of Philippine films of the 1940s, List of Philippine films of the 1950s, List of Philippine films of the 1960s, List of Philippine films of the 1970s, List of Philippine films of the 1980s, List of Philippine films of the 1990s, List of Philippine films of the 2010s, Liza Lorena, Louise delos Reyes, Lovi Poe, Mara Lopez, Maria Isabel Lopez, Meg Imperial, Megan Young, Michelle Madrigal, Music of the Philippines, Mylene Dizon, Nadine Lustre, Nova Villa, Pokwang, Regine Angeles, Relaks  It's Just Pag-ibig, Rochelle Pangilinan, Ruffa Gutierrez, Ryzza Mae Dizon, Sam Pinto, Sarah Geronimo, Sarah Lahbati, Solenn Heussaff, Sunshine Dizon, Sylvia Sanchez, Tetchie Agbayani, Vina Morales, Xian Lim, Zsa Zsa Padilla, 
Sheryl Cruz,14,Andi Eigenmann, Ara Mina, Babaeng Hampaslupa, Donna Cruz, Fernando Poe Jr., Geneva Cruz, Janice de Belen, Kristina Paner, Lea Salonga, Manilyn Reynes, Nadine Samonte, Rosemarie Sonora, Sunshine Cruz, Sunshine Dizon, 
Phoemela Baranda,4,Cinema of the Philippines, Extra Challenge, Miriam Quiambao, Philippines, 
Valerie Weigmann,41,Aleck Bovick, Ann Li, Barbie Imperial, Bea Saw, Beauty Gonzalez, Cassandra Ponti, Dionne Monsanto, Elisse Joson, Fretzie Bercede, Gaby Dela Merced, Gee-Ann Abrahan, Gerald Anderson, Heaven Peralejo, Jane Oineza, Jinri Park, Kaori Oinuma, Kisses Delavin, Maymay Entrata, Megan Young, Melai Cantiveros, Mich Dulce, Miho Nishida, Myrtle Sarrosa, Nene Tamayo, Nicole Uysiuseng, Niña Jose, Philippines, Pinoy Big Brother: Otso, Pinoy Big Brother: Season 1, Pinoy Big Brother: Season 2, Pinoy Big Brother: Teen Clash 2010, Riza Santos, Roxanne Barcelo, Sam Pinto, Seth Fedelin, Vickie Rushton, Vivoree Esclito, Wendy Valdez, Yayo Aguila, Yen Santos, Ylona Garcia, 
Alodia Gosiengfiao,7,Filipinos, Jennylyn Mercado, Jinri Park, Myrtle Sarrosa, Philippines, Sam Pinto, Tween Academy: Class of 2012, 
Jed Montero,2,Philippines, Pure Love (2014 TV series), 
Aruray,0,
Ina Feleo,3,Laurice Guillen, Philippines, Working Girls (2010 film), 
Joanne Santos-Quintas,15,Ariella Arida, Bianca Manalo, Charlene Gonzales, Gloria Diaz, Janine Tugonon, Maria Isabel Lopez, Mary Jean Lastimosa, Maxine Medina, Miriam Quiambao, Philippines, Rabiya Mateo, Rosario Silayan-Bailon, Ruffa Gutierrez, Shamcey Supsup-Lee, Venus Raj, 
Sue Prado,1,Pure Love (2014 TV series), 
Zia Marquez,9,Cassandra Ponti, Chanda Romero, Dawn Zulueta, Janina San Miguel, Melanie Marquez, Philippines, Sharmaine Arnaiz, Teresita Marquez, Venus Raj, 
Lucy Torres-Gomez,2,Filipinos, Philippines, 
Julia Montes,12,Aljur Abrenica, Angelu de Leon, Carmina Villarroel, Cherry Pie Picache, Claudine Barretto, Dawn Zulueta, Gerald Anderson, Lorna Tolentino, Mylene Dizon, Philippines, Shaina Magdayao, Young Critics Circle, 
Ruby Rodriguez,4,Helen Vela, Luane Dy, Pia Guanio, Ryzza Mae Dizon, 
Lota Delgado,1,Philippines, 
Elle Ramirez,7,Angelu de Leon, Gina Alajar, Gladys Reyes, Jolina Magdangal, Krizza Neri, Philippines, Thea Tolentino, 
Fernando Poe Jr.,6,Atang de la Rama, Charito Solis, FAMAS Award, Lovi Poe, Philippines, Vilma Santos, 
G. Toengi,2,It's Showtime (Philippine TV program), Philippines, 
Lotlot de Leon,5,Asawa Ko  Karibal Ko, Janine Gutierrez, Lilia Dizon, Matet de Leon, Philippines, 
LSS (film),0,
Cristina Gonzales,0,
Rita Avila,2,Darna (2009 TV series), Philippines, 
Rachel Alejandro,5,It's Showtime (Philippine TV program), Lyca Gairanod, Philippines, Rio Diaz, Zsa Zsa Padilla, 
Tita Muñoz,1,FAMAS Award, 
Anna Luna (actress),2,Philippines, Pure Love (2014 TV series), 
Valentina (Philippine comics),18,Alessandra De Rossi, Anne Curtis, Celia Rodriguez, Darna (2009 TV series), Denise Laurel, Dimples Romana, Iwa Moto, Jane De Leon, Janice de Belen, Jessy Mendiola, Jodi Sta. Maria, Katrina Halili, Liza Soberano, Maricar Reyes, Melissa Ricks, Nadine Samonte, Sarah Lahbati, Venus Raj, 
Carmina Villarroel,6,Bridges of Love, FAMAS Award, Gawad Urian Award, One More Try (film), Philippines, Young Critics Circle, 
Chicháy,5,Fernando Poe Jr., Katy de la Cruz, Nida Blanca, Sharon Cuneta, Vilma Santos, 
Stephanie Sol,1,Philippines, 
Kathleen Hermosa,1,Philippines, 
Ashley Ortega,1,Philippines, 
It's Showtime (Philippine TV program),19,Ai-Ai delas Alas, Amy Perez, Anne Curtis, Eula Valdez, Gerald Anderson, Gladys Reyes, Huwag Kang Mangamba, Ina Raymundo, Jim Paredes, Jolina Magdangal, Karylle, Lilia Cuntapay, Nadine Lustre, Pilipinas Win Na Win, Pops Fernandez, Precious Lara Quigaman, Rosanna Roces, Ruffa Gutierrez, Tawag ng Tanghalan, 
One More Try (film),26,Ai-Ai delas Alas, Angelica Panganiban, Angeline Quinto, Anne Curtis, Ara Mina, Assunta De Rossi, Charito Solis, Charo Santos-Concio, Coney Reyes, Dawn Zulueta, Elizabeth Oropesa, Gina Alajar, Gina Pareño, Gloria Romero (actress), Hilda Koronel, Irma Adlawan, Jennylyn Mercado, Judy Ann Santos, Laurice Guillen, Liza Lorena, Lolita Rodriguez, Melanie Marquez, Sharon Cuneta, Vilma Santos, Vivian Velez, Zsa Zsa Padilla, 
Pia Moran,4,Claudine Barretto, Gee-Ann Abrahan, Philippines, Shaina Magdayao, 
Alma Moreno,1,Amalia Fuentes, 
Ella Cruz,2,FAMAS Award, Philippines, 
Patricia Fernandez (actress),2,Janina San Miguel, Philippines, 
Jaclyn Jose,28,Andi Eigenmann, Anita Linda, Assunta De Rossi, Boots Anson-Roa, Charito Solis, Cherry Pie Picache, Daddy's Gurl, Elizabeth Oropesa, Eula Valdez, FAMAS Award, Gelli de Belen, Gina Alajar, Gina Pareño, Gloria Romero (actress), Judy Ann Santos, Katrina Halili, Lorna Tolentino, Mylene Dizon, Nadine Lustre, Nida Blanca, Philippines, Princess Punzalan, Rosanna Roces, Shaina Magdayao, Sharon Cuneta, Vilma Santos, Young Critics Circle, Zsa Zsa Padilla, 
Barbie Forteza,8,Bea Binene, Daddy's Gurl, Love You Two, Mylene Dizon, Philippines, Sanya Lopez, Thea Tolentino, Tween Academy: Class of 2012, 
Celia Rodriguez,38,Ai-Ai delas Alas, Aleck Bovick, Amalia Fuentes, Andi Eigenmann, Angelica Panganiban, Anita Linda, Anne Curtis, Ara Mina, Barbara Perez, Boots Anson-Roa, Carmen Rosales, Charito Solis, Claudine Barretto, Darna (2009 TV series), Dawn Zulueta, Dina Bonnevie, Elizabeth Oropesa, FAMAS Award, Gloria Romero (actress), Gloria Sevilla, Janine Gutierrez, Judy Ann Santos, KC Concepcion, Lolita Rodriguez, Lorna Tolentino, Lovi Poe, Marlene Daudén, Nadine Lustre, Nena Cardenas, Nida Blanca, Paraluman, Perla Bautista, Regine Velasquez, Rosa Rosal, Sharon Cuneta, Snooky Serna, Vilma Santos, Vivian Velez, 
Jinri Park,43,Aleck Bovick, Alodia Gosiengfiao, Ann Li, Barbie Imperial, Bea Saw, Beauty Gonzalez, Cassandra Ponti, Dionne Monsanto, Elisse Joson, Fretzie Bercede, Gaby Dela Merced, Gee-Ann Abrahan, Gerald Anderson, Grace Lee, Heaven Peralejo, Jane Oineza, Kaori Oinuma, Kisses Delavin, Maymay Entrata, Megan Young, Melai Cantiveros, Mich Dulce, Miho Nishida, Myrtle Sarrosa, Nene Tamayo, Nicole Uysiuseng, Niña Jose, Pinoy Big Brother: Otso, Pinoy Big Brother: Season 1, Pinoy Big Brother: Season 2, Pinoy Big Brother: Teen Clash 2010, Riza Santos, Roxanne Barcelo, Rufa Mae Quinto, Sam Pinto, Seth Fedelin, Valerie Weigmann, Vickie Rushton, Vivoree Esclito, Wendy Valdez, Yayo Aguila, Yen Santos, Ylona Garcia, 
Yasmien Kurdi,2,Filipinos, Sharon Cuneta, 
Kristel Fulgar,2,Pangako Sa 'Yo (2015 TV series), Philippines, 
Rafael de la Fuente,0,
Bella Flores,2,Philippines, Tessie Agana, 
100 Tula Para Kay Stella,2,Dennis Padilla, Mayton Eugenio, 
Claudine Barretto,55,Ai-Ai delas Alas, Aleck Bovick, Amalia Fuentes, Anak (film), Andi Eigenmann, Angelica Panganiban, Angelika Dela Cruz, Anita Linda, Anne Curtis, Ara Mina, Assunta De Rossi, Barbara Perez, Boots Anson-Roa, Carmen Rosales, Celia Rodriguez, Charito Solis, Cherry Pie Picache, Cinema of the Philippines, Dawn Zulueta, Dina Bonnevie, Elizabeth Oropesa, FAMAS Award, Fernando Poe Jr., Gloria Diaz, Gloria Romero (actress), Gloria Sevilla, Gretchen Barretto, Hilda Koronel, Janine Gutierrez, Jolina Magdangal, Judy Ann Santos, KC Concepcion, Kris Aquino, Lolita Rodriguez, Lorna Tolentino, Lovi Poe, Luna Award, Marjorie Barretto, Marlene Daudén, Meg Imperial, Mylene Dizon, Nadine Lustre, Nena Cardenas, Nida Blanca, Paraluman, Paula Peralejo, Perla Bautista, Philippines, Rio Locsin, Rosa Rosal, Shaina Magdayao, Sharon Cuneta, Snooky Serna, Vilma Santos, Vivian Velez, 
Maricar de Mesa,2,Filipinos, Philippines, 
Maybelyn dela Cruz,8,Aljur Abrenica, Diana Zubiri, Dina Bonnevie, Nadine Samonte, Nova Villa, Philippines, Sunshine Dizon, Yasmien Kurdi, 
Dimples Romana,5,Beverly Vergel, Huwag Kang Mangamba, It's Showtime (Philippine TV program), One More Chance (2007 film), Philippines, 
Jim Paredes,1,Music of the Philippines, 
Moira Dela Torre,12,Camp Sawi, Elha Nympha, Emmanuelle Vera, Esang de Torres, Filipinos, Karla Estrada, Lougee Basabas, Lyca Gairanod, Music of the Philippines, Regine Velasquez, Rufa Mi, Zephanie Dimaranan, 
List of Uzbekistani film actors,26,List of Afghans, List of Armenian actors, List of Azerbaijani actors, List of Bangladeshi actors, List of Bhutanese actors, List of Chinese actors, List of Chinese actresses, List of Filipino actresses, List of Filipino male actors, List of Indian film actresses, List of Iranian actresses, List of Iranian male actors, List of Israeli actors, List of Japanese actors, List of Jordanian actors, List of Malaysian actors, List of Nepalese actors, List of North Korean actors, List of Sri Lankan actors, List of Taiwanese actresses, List of Thai actresses, List of Thai male actors, List of Turkish actors, List of Vietnamese actors, Lists of Indian actors, Lists of Philippine actors, 
Franchesca Salcedo,2,Bianca Umali, Philippines, 
Karla Estrada,2,It's Showtime (Philippine TV program), Philippines, 
Arny Ross,6,Elle Ramirez, Gina Alajar, Jennylyn Mercado, Krizza Neri, Philippines, Thea Tolentino, 
Nida Blanca,47,Ai-Ai delas Alas, Aleck Bovick, Amalia Fuentes, Andi Eigenmann, Angelica Panganiban, Anita Linda, Anne Curtis, Ara Mina, Assunta De Rossi, Barbara Perez, Boots Anson-Roa, Carmen Rosales, Celia Rodriguez, Charito Solis, Cherry Pie Picache, Claudine Barretto, Dawn Zulueta, Dina Bonnevie, Elizabeth Oropesa, Eula Valdez, Gelli de Belen, Gina Alajar, Gina Pareño, Gloria Romero (actress), Gloria Sevilla, Jaclyn Jose, Janine Gutierrez, Judy Ann Santos, KC Concepcion, Lolita Rodriguez, Lorna Tolentino, Lovi Poe, Marlene Daudén, Mylene Dizon, Nadine Lustre, Nena Cardenas, Paraluman, Perla Bautista, Philippines, Rosa Rosal, Rosanna Roces, Sharon Cuneta, Snooky Serna, Sylvia La Torre, Vilma Santos, Vivian Velez, Zsa Zsa Padilla, 
Christine Evangelista,0,
Etang Discher,2,Katy de la Cruz, Philippines, 
Kisses Delavin,43,Aleck Bovick, Ann Li, Barbie Imperial, Bea Saw, Beauty Gonzalez, Cassandra Ponti, Dionne Monsanto, Elisse Joson, Filipinos, Fretzie Bercede, Gaby Dela Merced, Gee-Ann Abrahan, Gerald Anderson, Heaven Peralejo, Jane Oineza, Jinri Park, Kaori Oinuma, Maymay Entrata, Megan Young, Melai Cantiveros, Mich Dulce, Miho Nishida, Myrtle Sarrosa, Nene Tamayo, Nicole Uysiuseng, Niña Jose, Pangako Sa 'Yo (2015 TV series), Philippines, Pinoy Big Brother: Otso, Pinoy Big Brother: Season 1, Pinoy Big Brother: Season 2, Pinoy Big Brother: Teen Clash 2010, Riza Santos, Roxanne Barcelo, Sam Pinto, Seth Fedelin, Valerie Weigmann, Vickie Rushton, Vivoree Esclito, Wendy Valdez, Yayo Aguila, Yen Santos, Ylona Garcia, 
Pia Guanio,6,Filipinos, Grace Lee, Luane Dy, Philippines, Ruby Rodriguez, Ryzza Mae Dizon, 
Myrtle Sarrosa,44,Aleck Bovick, Ann Li, Barbie Imperial, Bea Saw, Beauty Gonzalez, Cassandra Ponti, Dionne Monsanto, Elisse Joson, Fretzie Bercede, Gaby Dela Merced, Gee-Ann Abrahan, Gerald Anderson, Heaven Peralejo, Jane Oineza, Jennylyn Mercado, Jinri Park, Kaori Oinuma, Kisses Delavin, Liza Soberano, Maymay Entrata, Megan Young, Melai Cantiveros, Mich Dulce, Miho Nishida, Nadine Lustre, Nene Tamayo, Nicole Uysiuseng, Niña Jose, Philippines, Pinoy Big Brother: Otso, Pinoy Big Brother: Season 1, Pinoy Big Brother: Season 2, Pinoy Big Brother: Teen Clash 2010, Riza Santos, Roxanne Barcelo, Sam Pinto, Seth Fedelin, Valerie Weigmann, Vickie Rushton, Vivoree Esclito, Wendy Valdez, Yayo Aguila, Yen Santos, Ylona Garcia, 
Toni Rose Gayda,2,Philippines, Rosa Rosal, 
Patricia Tumulak,5,Hanggang sa Dulo ng Buhay Ko, Luane Dy, Pia Guanio, Ruby Rodriguez, Ryzza Mae Dizon, 
List of Sri Lankan actors,26,List of Afghans, List of Armenian actors, List of Azerbaijani actors, List of Bangladeshi actors, List of Bhutanese actors, List of Chinese actors, List of Chinese actresses, List of Filipino actresses, List of Filipino male actors, List of Indian film actresses, List of Iranian actresses, List of Iranian male actors, List of Israeli actors, List of Japanese actors, List of Jordanian actors, List of Malaysian actors, List of Nepalese actors, List of North Korean actors, List of Taiwanese actresses, List of Thai actresses, List of Thai male actors, List of Turkish actors, List of Uzbekistani film actors, List of Vietnamese actors, Lists of Indian actors, Lists of Philippine actors, 
List of Philippine films of the 1980s,123,1984 in the Philippines, Alma Moreno, Alona Alegre, Amalia Fuentes, Amy Perez, Ana Roces, Anita Linda, Anna Marie Gutierrez, Armida Siguion-Reyna, Aurora Sevilla, Barbara Perez, Bella Flores, Beverly Vergel, Bing Loyzaga, Caridad Sanchez, Carmi Martin, Celia Rodriguez, Chanda Romero, Charito Solis, Charo Santos-Concio, Chicháy, Cinema of the Philippines, Claudia Zobel, Coney Reyes, Cristina Gonzales, Dawn Zulueta, Dely Atay-Atayan, Dexter Doria, Dina Bonnevie, Elizabeth Oropesa, Eula Valdez, FAMAS Award, Fernando Poe Jr., Gawad Urian Award, Gelli de Belen, Gina Alajar, Gina Pareño, Gloria Diaz, Gloria Romero (actress), Gretchen Barretto, Harlene Bautista, Hilda Koronel, Isabel Granada, Isabel Rivas, Jackie Lou Blanco, Jaclyn Jose, Janice de Belen, Jean Garcia, Kristina Paner, Lani Mercado, Laurice Guillen, Lea Salonga, List of Philippine co-produced films and television series, List of Philippine films before 1940, List of Philippine films of 2011, List of Philippine films of 2012, List of Philippine films of 2013, List of Philippine films of 2014, List of Philippine films of 2015, List of Philippine films of 2016, List of Philippine films of 2017, List of Philippine films of 2018, List of Philippine films of 2019, List of Philippine films of 2020, List of Philippine films of the 1940s, List of Philippine films of the 1950s, List of Philippine films of the 1960s, List of Philippine films of the 1970s, List of Philippine films of the 1990s, List of Philippine films of the 2010s, List of Philippine submissions for the Academy Award for Best International Feature Film, List of highest-grossing films in the Philippines, List of people who won the Philippine movie grand slam, Lists of Philippine films, Liz Alindogan, Liza Lorena, Lolita Rodriguez, Lorna Tolentino, Lotlot de Leon, Lucita Soriano, Luna Award, Luz Valdez, Manilyn Reynes, Maria Isabel Lopez, Marianne dela Riva, Maricel Laxa, Marissa Delgado, Marita Zobel, Mary Walter, Matet de Leon, Melanie Marquez, Melissa Mendez, Metring David, Michael de Mesa, Music of the Philippines, Nanette Medved, Nida Blanca, Nova Villa, Perla Bautista, Philippines, Pia Moran, Pinky Amador, Princess Punzalan, Regine Velasquez, Rio Locsin, Rita Avila, Rosa Mia, Ruffa Gutierrez, Sandy Andolong, Sharon Cuneta, Sheryl Cruz, Snooky Serna, Sunshine Dizon, Suzette Ranillo, Sylvia La Torre, Tetchie Agbayani, Tita Muñoz, Tiya Pusit, Vilma Santos, Vina Morales, Vivian Velez, Young Critics Circle, Zsa Zsa Padilla, 
Pure Love (2014 TV series),11,Alex Gonzaga, Ana Capri, Anna Luna (actress), Dionne Monsanto, Helga Krapf, Hiyasmin Neri, Jed Montero, Sunshine Cruz, Sylvia Sanchez, Tetchie Agbayani, Yen Santos, 
Shaina Magdayao,8,Claudine Barretto, Filipinos, Four Sisters and a Wedding, Gerald Anderson, Julia Montes, Nang Ngumiti ang Langit, Philippines, Vina Morales, 
Lani Misalucha,9,It's Showtime (Philippine TV program), Jaya (singer), KZ Tandingan, Kuh Ledesma, Pops Fernandez, Regine Velasquez, Sarah Geronimo, Yeng Constantino, Zsa Zsa Padilla, 
Mahal (actress),4,Ai-Ai delas Alas, Inday Badiday, Pokwang, Rosanna Roces, 
Atang de la Rama,1,Fernando Poe Jr., 
List of Afghans,0,
Ariella Arida,18,Bianca Manalo, Charlene Gonzales, Filipinos, Gloria Diaz, It's Showtime (Philippine TV program), Janine Tugonon, Joanne Santos-Quintas, Maria Isabel Lopez, Mary Jean Lastimosa, Maxine Medina, Miriam Quiambao, Mutya Johanna Datul, Philippines, Rabiya Mateo, Riza Santos, Rosario Silayan-Bailon, Shamcey Supsup-Lee, Venus Raj, 
Suzette Ranillo,3,Gloria Sevilla, Krista Ranillo, Philippines, 
Michael de Mesa,6,Andi Eigenmann, Gawad Urian Award, Geoff Eigenmann, Gina Alajar, Ikaw Lang ang Iibigin, Philippines, 
Vickie Rushton,41,Aleck Bovick, Ann Li, Barbie Imperial, Bea Saw, Beauty Gonzalez, Cassandra Ponti, Dionne Monsanto, Elisse Joson, Fretzie Bercede, Gaby Dela Merced, Gee-Ann Abrahan, Gerald Anderson, Heaven Peralejo, Jane Oineza, Jinri Park, Kaori Oinuma, Kisses Delavin, Maymay Entrata, Megan Young, Melai Cantiveros, Mich Dulce, Miho Nishida, Myrtle Sarrosa, Nene Tamayo, Nicole Uysiuseng, Niña Jose, Philippines, Pinoy Big Brother: Otso, Pinoy Big Brother: Season 1, Pinoy Big Brother: Season 2, Pinoy Big Brother: Teen Clash 2010, Riza Santos, Roxanne Barcelo, Sam Pinto, Seth Fedelin, Valerie Weigmann, Vivoree Esclito, Wendy Valdez, Yayo Aguila, Yen Santos, Ylona Garcia, 
Kaori Oinuma,42,Aleck Bovick, Ann Li, Barbie Imperial, Bea Saw, Beauty Gonzalez, Belle Mariano, Cassandra Ponti, Dionne Monsanto, Elisse Joson, Filipinos, Fretzie Bercede, Gaby Dela Merced, Gee-Ann Abrahan, Gerald Anderson, Heaven Peralejo, Jane Oineza, Jinri Park, Kisses Delavin, Maymay Entrata, Megan Young, Melai Cantiveros, Mich Dulce, Miho Nishida, Myrtle Sarrosa, Nene Tamayo, Nicole Uysiuseng, Niña Jose, Pinoy Big Brother: Otso, Pinoy Big Brother: Season 1, Pinoy Big Brother: Season 2, Pinoy Big Brother: Teen Clash 2010, Riza Santos, Roxanne Barcelo, Sam Pinto, Seth Fedelin, Valerie Weigmann, Vickie Rushton, Vivoree Esclito, Wendy Valdez, Yayo Aguila, Yen Santos, Ylona Garcia, 
Dennis Padilla,3,It's Showtime (Philippine TV program), Marjorie Barretto, Philippines, 
Filipinos,3,Cinema of the Philippines, Music of the Philippines, Philippines, 
Mylene Dizon,30,Anita Linda, Assunta De Rossi, Bianca Umali, Carmina Villarroel, Charito Solis, Cherry Pie Picache, Claudine Barretto, Elizabeth Oropesa, Eula Valdez, Gelli de Belen, Gina Alajar, Gina Pareño, Gloria Romero (actress), Huwag Kang Mangamba, Jaclyn Jose, Jodi Sta. Maria, Judy Ann Santos, Julia Montes, Lorna Tolentino, Luna Award, Maxene Magalona, Melissa Ricks, Nadine Lustre, Nida Blanca, Philippines, Rosanna Roces, Sharon Cuneta, Vilma Santos, Working Girls (2010 film), Zsa Zsa Padilla, 
Shamaine Buencamino,3,Filipinos, One More Chance (2007 film), Philippines, 
Princess Punzalan,7,Aljur Abrenica, Claudine Barretto, Eula Valdez, Filipinos, Helen Vela, Philippines, Ryza Cenon, 
Julia Clarete,1,Philippines, 
Bianca Umali,1,Filipinos, 
List of Philippine films of the 1960s,47,1984 in the Philippines, Amalia Fuentes, Barbara Perez, Bella Flores, Charito Solis, Cinema of the Philippines, Dely Atay-Atayan, Eva Darren, FAMAS Award, Fernando Poe Jr., Gawad Urian Award, Gloria Romero (actress), Lilia Dizon, List of Philippine co-produced films and television series, List of Philippine films before 1940, List of Philippine films of 2011, List of Philippine films of 2012, List of Philippine films of 2013, List of Philippine films of 2014, List of Philippine films of 2015, List of Philippine films of 2016, List of Philippine films of 2017, List of Philippine films of 2018, List of Philippine films of 2019, List of Philippine films of 2020, List of Philippine films of the 1940s, List of Philippine films of the 1950s, List of Philippine films of the 1970s, List of Philippine films of the 1980s, List of Philippine films of the 1990s, List of Philippine films of the 2010s, List of Philippine submissions for the Academy Award for Best International Feature Film, List of highest-grossing films in the Philippines, List of people who won the Philippine movie grand slam, Lists of Philippine films, Lolita Rodriguez, Luna Award, Mary Walter, Music of the Philippines, Nida Blanca, Nova Villa, Paraluman, Philippines, Rosa Mia, Tessie Agana, Vilma Santos, Young Critics Circle, 
Halina Perez,1,Diana Zubiri, 
Matimtiman Cruz,1,Philippines, 
Ann Li,44,Aleck Bovick, Barbie Imperial, Bea Saw, Beauty Gonzalez, Cassandra Ponti, Dionne Monsanto, Elisse Joson, Filipinos, Fretzie Bercede, Gaby Dela Merced, Gee-Ann Abrahan, Gerald Anderson, Heaven Peralejo, Jane Oineza, Jinri Park, KC Concepcion, Kaori Oinuma, Kisses Delavin, Kris Aquino, Maymay Entrata, Megan Young, Melai Cantiveros, Mich Dulce, Miho Nishida, Myrtle Sarrosa, Nene Tamayo, Nicole Uysiuseng, Niña Jose, Philippines, Pinoy Big Brother: Otso, Pinoy Big Brother: Season 1, Pinoy Big Brother: Season 2, Pinoy Big Brother: Teen Clash 2010, Riza Santos, Roxanne Barcelo, Sam Pinto, Seth Fedelin, Valerie Weigmann, Vickie Rushton, Vivoree Esclito, Wendy Valdez, Yayo Aguila, Yen Santos, Ylona Garcia, 
