List of people who won the Philippine movie grand slam,36,Anak (film), Angelica Panganiban, Anita Linda, Armida Siguion-Reyna, Cinema of the Philippines, Elizabeth Oropesa, FAMAS Award, Gawad Urian Award, Gina Alajar, Gina Pareño, Gloria Romero (actress), Glydel Mercado, Jaclyn Jose, Laurice Guillen, List of Philippine co-produced films and television series, List of Philippine films before 1940, List of Philippine films of the 1940s, List of Philippine films of the 1950s, List of Philippine films of the 1960s, List of Philippine films of the 1970s, List of Philippine films of the 1980s, List of Philippine films of the 1990s, List of Philippine films of the 2010s, List of Philippine submissions for the Academy Award for Best International Feature Film, List of highest-grossing films in the Philippines, Lists of Philippine films, Lorna Tolentino, Luna Award, Nida Blanca, One More Try (film), Rufa Mae Quinto, Sharon Cuneta, Vilma Santos, Vivian Velez, Young Critics Circle, Zsa Zsa Padilla, 
Ariana Barouk,1,Philippines, 
Mariel Pamintuan,5,Bianca Umali, Charee Pineda, Manilyn Reynes, Maxene Magalona, Sunshine Cruz, 
Princess Ryan,1,It's Showtime (Philippine TV program), 
Karen delos Reyes,2,Extra Challenge, Philippines, 
Nori Dalisay,0,
List of medieval abbreviations,0,
Daria,0,
Cherry Lou,1,Philippines, 
Diana Zubiri,18,Andrea Torres, Assunta De Rossi, Aubrey Miles, Beauty Gonzalez, Cindy Kurleto, Claudine Barretto, Donita Rose, Gerald Anderson, Jennylyn Mercado, Jessy Mendiola, Katrina Halili, Maui Taylor, Myrtle Sarrosa, Nadine Lustre, Philippines, Sam Pinto, Sunshine Cruz, Young Critics Circle, 
Frances Makil-Ignacio,2,Pamilya Roces, Second Chances (Philippine TV series), 
Tanya Garcia,6,Angelu de Leon, Filipinos, Jennylyn Mercado, Judy Ann Santos, Nadine Samonte, Philippines, 
Charito de León,2,Emma Alegre, Nida Blanca, 
Angeli Gonzales,2,Miles Ocampo, Philippines, 
List of Philippine films of 2015,60,1984 in the Philippines, Ai-Ai delas Alas, Alex Gonzaga, Andi Eigenmann, Angelica Panganiban, Barbie Forteza, Bea Binene, Boots Anson-Roa, Carla Abellana, Ces Quesada, Cinema of the Philippines, Claudine Barretto, Crazy Beautiful You, Dawn Zulueta, Dionne Monsanto, Emmanuelle Vera, Gerald Anderson, Gwen Zamora, Janella Salvador, Janine Gutierrez, Jasmine Curtis-Smith, Jennylyn Mercado, Jodi Sta. Maria, Julia Montes, Kris Aquino, List of Philippine films before 1940, List of Philippine films of 2011, List of Philippine films of 2012, List of Philippine films of 2013, List of Philippine films of 2014, List of Philippine films of 2016, List of Philippine films of 2017, List of Philippine films of 2018, List of Philippine films of 2019, List of Philippine films of 2020, List of Philippine films of the 1940s, List of Philippine films of the 1950s, List of Philippine films of the 1960s, List of Philippine films of the 1970s, List of Philippine films of the 1980s, List of Philippine films of the 1990s, List of Philippine films of the 2010s, Liza Soberano, Lotlot de Leon, Meg Imperial, Mercedes Cabral, Mona Louise Rey, Music of the Philippines, Nadine Lustre, Nova Villa, Pokwang, Rhian Ramos, Rio Locsin, Sarah Geronimo, Sarah Lahbati, Shy Carlos, Snooky Serna, Solenn Heussaff, Xian Lim, Ynna Asistio, 
Metring David,2,Nida Blanca, Philippines, 
Angeli Nicole Sanoy,5,Aljur Abrenica, Carla Abellana, Darna (2009 TV series), Geoff Eigenmann, Temptation of Wife (2012 TV series), 
Emma Henry,1,Philippines, 
List of North Korean actors,26,List of Afghans, List of Armenian actors, List of Azerbaijani actors, List of Bangladeshi actors, List of Bhutanese actors, List of Chinese actors, List of Chinese actresses, List of Filipino actresses, List of Filipino male actors, List of Indian film actresses, List of Iranian actresses, List of Iranian male actors, List of Israeli actors, List of Japanese actors, List of Jordanian actors, List of Malaysian actors, List of Nepalese actors, List of Sri Lankan actors, List of Taiwanese actresses, List of Thai actresses, List of Thai male actors, List of Turkish actors, List of Uzbekistani film actors, List of Vietnamese actors, Lists of Indian actors, Lists of Philippine actors, 
Letty Alonzo,1,Valeen Montenegro, 
Tessie Agana,2,Cinema of the Philippines, Linda Estrella, 
Mosang,3,Janna Dominguez, Manilyn Reynes, Philippines, 
Jolina Magdangal,25,Beverly Vergel, Carmina Villarroel, Claudine Barretto, Dimples Romana, Dina Bonnevie, Eugene Domingo, Gina Alajar, It's Showtime (Philippine TV program), Jake Zyrus, Jean Garcia, Jennylyn Mercado, Jodi Sta. Maria, Jolina Magdangal, Judy Ann Santos, Karla Estrada, Melai Cantiveros, Philippines, Regine Velasquez, Rhian Ramos, Rosa Rosal, Rufa Mae Quinto, Sharon Cuneta, StarStruck (season 4), Tawag ng Tanghalan, Yeng Constantino, 
Sophie Albert,4,Artista Academy, Kris Aquino, Pamilya Roces, Philippines, 
Andi Eigenmann,39,Ai-Ai delas Alas, Aleck Bovick, Amalia Fuentes, Angelica Panganiban, Anita Linda, Anne Curtis, Ara Mina, Barbara Perez, Boots Anson-Roa, Camp Sawi, Carmen Rosales, Celia Rodriguez, Charito Solis, Claudine Barretto, Dawn Zulueta, Dina Bonnevie, Elizabeth Oropesa, Gloria Romero (actress), Gloria Sevilla, Jaclyn Jose, Janice de Belen, Janine Gutierrez, Judy Ann Santos, KC Concepcion, Lolita Rodriguez, Lorna Tolentino, Lovi Poe, Marlene Daudén, Nadine Lustre, Nena Cardenas, Nida Blanca, Paraluman, Perla Bautista, Philippines, Rosa Rosal, Sharon Cuneta, Snooky Serna, Vilma Santos, Vivian Velez, 
Riza Santos,43,Aleck Bovick, Ann Li, Ariella Arida, Barbie Imperial, Bea Saw, Beauty Gonzalez, Cassandra Ponti, Dionne Monsanto, Elisse Joson, Filipinos, Fretzie Bercede, Gaby Dela Merced, Gee-Ann Abrahan, Gerald Anderson, Heaven Peralejo, Jane Oineza, Jinri Park, Kaori Oinuma, Kisses Delavin, Maymay Entrata, Megan Young, Melai Cantiveros, Mich Dulce, Miho Nishida, Myrtle Sarrosa, Nene Tamayo, Nicole Uysiuseng, Niña Jose, Philippines, Pinoy Big Brother: Otso, Pinoy Big Brother: Season 1, Pinoy Big Brother: Season 2, Pinoy Big Brother: Teen Clash 2010, Roxanne Barcelo, Sam Pinto, Seth Fedelin, Valerie Weigmann, Vickie Rushton, Vivoree Esclito, Wendy Valdez, Yayo Aguila, Yen Santos, Ylona Garcia, 
Arra San Agustin,2,Filipinos, Philippines, 
Barbie Imperial,42,Aleck Bovick, Ann Li, Bea Saw, Beauty Gonzalez, Cassandra Ponti, Dionne Monsanto, Elisse Joson, Filipinos, Fretzie Bercede, Gaby Dela Merced, Gee-Ann Abrahan, Gerald Anderson, Heaven Peralejo, It's Showtime (Philippine TV program), Jane Oineza, Jinri Park, Kaori Oinuma, Kisses Delavin, Maymay Entrata, Megan Young, Melai Cantiveros, Mich Dulce, Miho Nishida, Myrtle Sarrosa, Nene Tamayo, Nicole Uysiuseng, Niña Jose, Pinoy Big Brother: Otso, Pinoy Big Brother: Season 1, Pinoy Big Brother: Season 2, Pinoy Big Brother: Teen Clash 2010, Riza Santos, Roxanne Barcelo, Sam Pinto, Seth Fedelin, Valerie Weigmann, Vickie Rushton, Vivoree Esclito, Wendy Valdez, Yayo Aguila, Yen Santos, Ylona Garcia, 
Lorna Tolentino,51,Ai-Ai delas Alas, Aleck Bovick, Amalia Fuentes, Amy Perez, Andi Eigenmann, Angelica Panganiban, Anita Linda, Anne Curtis, Ara Mina, Artista Academy, Assunta De Rossi, Barbara Perez, Boots Anson-Roa, Carmen Rosales, Celia Rodriguez, Charito Solis, Cherry Pie Picache, Claudine Barretto, Crazy Beautiful You, Dawn Zulueta, Dina Bonnevie, Elizabeth Oropesa, Eula Valdez, Gelli de Belen, Gina Alajar, Gina Pareño, Gloria Romero (actress), Gloria Sevilla, Jaclyn Jose, Janine Gutierrez, Judy Ann Santos, KC Concepcion, Lolita Rodriguez, Lovi Poe, Marlene Daudén, Mylene Dizon, Nadine Lustre, Nena Cardenas, Nida Blanca, Paraluman, Perla Bautista, Philippines, Rosa Rosal, Rosanna Roces, Sharon Cuneta, Snooky Serna, StarStruck (season 4), Vilma Santos, Vivian Velez, Zia Quizon, Zsa Zsa Padilla, 
Isabel Granada,6,Filipinos, It's Showtime (Philippine TV program), Judy Ann Santos, Kim Rodriguez, Lovi Poe, Philippines, 
Hazel Ann Mendoza,6,Anak (film), Andrea Torres, Darna (2009 TV series), Isabel Blaesi, Karel Marquez, Paw Diaz, 
Lilia Dizon,5,Janine Gutierrez, Lotlot de Leon, Matet de Leon, Philippines, Sandy Andolong, 
Analyn Barro,6,Asawa Ko  Karibal Ko, Hanggang sa Dulo ng Buhay Ko, Janine Gutierrez, Jennylyn Mercado, Philippines, Sanya Lopez, 
Mariz (actress),2,Aljur Abrenica, Philippines, 
Sanya Lopez,6,Barbie Forteza, Daddy's Gurl, Diana Zubiri, Filipinos, Jinri Park, Kim Rodriguez, 
StarStruck (season 4),9,Aljur Abrenica, Jewel Mische, Jolina Magdangal, Judy Ann Santos, Lorna Tolentino, Regine Velasquez, Rich Asuncion, Sheena Halili, StarStruck (season 5), 
List of Chinese actors,26,List of Afghans, List of Armenian actors, List of Azerbaijani actors, List of Bangladeshi actors, List of Bhutanese actors, List of Chinese actresses, List of Filipino actresses, List of Filipino male actors, List of Indian film actresses, List of Iranian actresses, List of Iranian male actors, List of Israeli actors, List of Japanese actors, List of Jordanian actors, List of Malaysian actors, List of Nepalese actors, List of North Korean actors, List of Sri Lankan actors, List of Taiwanese actresses, List of Thai actresses, List of Thai male actors, List of Turkish actors, List of Uzbekistani film actors, List of Vietnamese actors, Lists of Indian actors, Lists of Philippine actors, 
Herlene Budol,0,
Aring Bautista,0,
Mikee Quintos,1,Jennylyn Mercado, 
Sheree Bautista,0,
Wendy Valdez,43,Aleck Bovick, Ann Li, Babaeng Hampaslupa, Barbie Imperial, Bea Saw, Beauty Gonzalez, Carlene Aguilar, Cassandra Ponti, Dionne Monsanto, Elisse Joson, Fretzie Bercede, Gaby Dela Merced, Gee-Ann Abrahan, Gerald Anderson, Heaven Peralejo, Jane Oineza, Jinri Park, Kaori Oinuma, Kisses Delavin, Maymay Entrata, Megan Young, Melai Cantiveros, Mich Dulce, Miho Nishida, Myrtle Sarrosa, Nene Tamayo, Nicole Uysiuseng, Niña Jose, Pinoy Big Brother: Otso, Pinoy Big Brother: Season 1, Pinoy Big Brother: Season 2, Pinoy Big Brother: Teen Clash 2010, Precious Lara Quigaman, Riza Santos, Roxanne Barcelo, Sam Pinto, Seth Fedelin, Valerie Weigmann, Vickie Rushton, Vivoree Esclito, Yayo Aguila, Yen Santos, Ylona Garcia, 
Lougee Basabas,1,Kitchie Nadal, 
List of Sundance Film Festival selections,0,
List of Philippine films of 2013,101,1984 in the Philippines, Andi Eigenmann, Angelica Panganiban, Angeline Quinto, Anita Linda, Ara Mina, Arci Muñoz, Barbara Miguel, Barbie Forteza, Bianca Manalo, Candy Pangilinan, Carmi Martin, Cherry Pie Picache, Cinema of the Philippines, Coney Reyes, Dawn Zulueta, Dennis Padilla, Dianne Medina, Dimples Romana, Ellen Adarna, Empress Schuck, Erika Padilla, Eugene Domingo, Eula Valdez, Four Sisters and a Wedding, Gerald Anderson, Gloria Diaz, Gloria Sevilla, Irma Adlawan, Isabel Granada, Iwa Moto, Jackie Lou Blanco, Jaclyn Jose, Janice de Belen, Jennylyn Mercado, Jessy Mendiola, Julia Clarete, Julia Montes, KC Concepcion, Kat Alano, Kitchie Nadal, Kris Aquino, Lauren Young, List of Philippine films before 1940, List of Philippine films of 2011, List of Philippine films of 2012, List of Philippine films of 2014, List of Philippine films of 2015, List of Philippine films of 2016, List of Philippine films of 2017, List of Philippine films of 2018, List of Philippine films of 2019, List of Philippine films of 2020, List of Philippine films of the 1940s, List of Philippine films of the 1950s, List of Philippine films of the 1960s, List of Philippine films of the 1970s, List of Philippine films of the 1980s, List of Philippine films of the 1990s, List of Philippine films of the 2010s, Liza Soberano, Louise delos Reyes, Lovi Poe, Luz Valdez, Maricar Reyes, Matet de Leon, Max Collins (actress), Meg Imperial, Michael de Mesa, Miles Ocampo, Miriam Quiambao, Music of the Philippines, Mylene Dizon, Nadine Samonte, Nikki Valdez, Nova Villa, Perla Bautista, Pinky Amador, Pokwang, Precious Lara Quigaman, RR Enriquez, Rich Asuncion, Rico J. Puno, Rufa Mae Quinto, Ruffa Gutierrez, Ryzza Mae Dizon, Sam Pinto, Sandy Andolong, Sarah Geronimo, Sarah Lahbati, Shaina Magdayao, Solenn Heussaff, Vilma Santos, Vivian Velez, Wendy Valdez, When the Love Is Gone, Xian Lim, Xyriel Manabat, Yayo Aguila, Yeng Constantino, Zsa Zsa Padilla, 
Rebecca Del Rio,8,Aruray, Bella Flores, Charito Solis, Gloria Romero (actress), List of Filipino actresses, Lolita Rodriguez, Philippines, Rosa Mia, 
Ice Seguerra,9,Bituin Escalante, Elle Ramirez, Eula Valdez, Gina Pareño, Krizza Neri, Liza Diño, Philippines, Rachel Alejandro, Thea Tolentino, 
Belle Mariano,2,Filipinos, On the Wings of Love (TV series), 
List of Philippine films of 2019,100,1984 in the Philippines, Ai-Ai delas Alas, Alessandra De Rossi, Alexa Ilacad, Angelica Panganiban, Anita Linda, Anna Luna (actress), Anne Curtis, Ara Mina, Arci Muñoz, Barbie Imperial, Beauty Gonzalez, Bianca Umali, Charo Santos-Concio, Cinema of the Philippines, Dawn Zulueta, Dennis Padilla, Dexter Doria, Diana Zubiri, Dianne Medina, Dionne Monsanto, Elisse Joson, Elizabeth Oropesa, Ella Cruz, Emmanuelle Vera, Eula Valdez, Gelli de Belen, Gerald Anderson, Gina Alajar, Gloria Sevilla, Jane Oineza, Janella Salvador, Janine Gutierrez, Jasmine Curtis-Smith, Jean Garcia, Jef Gaitan, Jennylyn Mercado, Jessy Mendiola, Jodi Sta. Maria, Judy Ann Santos, Kakai Bautista, Karla Estrada, Karylle, Katrina Halili, Kim Molina, Krystal Reyes, Kyline Alcantara, Laurice Guillen, List of Philippine films before 1940, List of Philippine films of 2011, List of Philippine films of 2012, List of Philippine films of 2013, List of Philippine films of 2014, List of Philippine films of 2015, List of Philippine films of 2016, List of Philippine films of 2017, List of Philippine films of 2018, List of Philippine films of 2020, List of Philippine films of the 1940s, List of Philippine films of the 1950s, List of Philippine films of the 1960s, List of Philippine films of the 1970s, List of Philippine films of the 1980s, List of Philippine films of the 1990s, List of Philippine films of the 2010s, Lists of Philippine films, Liza Lorena, Liza Soberano, Louise delos Reyes, Lovi Poe, Maria Isabel Lopez, Maxene Magalona, Michael de Mesa, Miles Ocampo, Music of the Philippines, Mylene Dizon, Myrtle Sarrosa, Nadine Lustre, Pokwang, Rachel Alejandro, Roxanne Barcelo, Rufa Mae Quinto, Sarah Geronimo, Seth Fedelin, Shaira Diaz, Sharlene San Pedro, Sharon Cuneta, Solenn Heussaff, Sue Ramirez, Sunshine Cruz, Sunshine Dizon, Susan Africa, Suzette Ranillo, Sylvia Sanchez, Teresita Marquez, Xian Lim, Yayo Aguila, Yen Santos, Yeng Constantino, Ynna Asistio, 
Serena Dalrymple,3,Claudine Barretto, Philippines, Shaina Magdayao, 
Teresita Marquez,6,Alma Moreno, Carla Abellana, Daddy's Gurl, Melanie Marquez, Philippines, Zia Marquez, 
Paw Diaz,26,Ai-Ai delas Alas, Andrea Torres, Anne Curtis, Brenna Garcia, Charee Pineda, Eda Nolan, Eula Valdez, Gladys Reyes, Gloria Diaz, Hazel Ann Mendoza, Isabel Blaesi, Janelle Quintana, Janine Berdin, KC Concepcion, Karel Marquez, Kyline Alcantara, Maricel Laxa, Marla Boyd, Melissa Ricks, Michelle Madrigal, Philippines, Roxanne Guinoo, Ruffa Gutierrez, Sharlene San Pedro, Vina Morales, Xyriel Manabat, 
Anak (film),8,Charo Santos-Concio, Cherry Pie Picache, Cinema of the Philippines, Claudine Barretto, Hazel Ann Mendoza, List of Philippine submissions for the Academy Award for Best International Feature Film, Philippines, Vilma Santos, 
Nikka Valencia,5,Bridges of Love, Claudine Barretto, Gelli de Belen, Jolina Magdangal, Philippines, 
Cris Villonco,3,Armida Siguion-Reyna, Fernando Poe Jr., Lea Salonga, 
Lani Mercado,1,Philippines, 
Georgina Wilson,3,Gloria Diaz, It's Showtime (Philippine TV program), Maureen Wroblewitz, 
List of Philippine films of the 1990s,128,1984 in the Philippines, Alma Moreno, Amy Perez, Ana Capri, Angelica Panganiban, Angelika Dela Cruz, Angelu de Leon, Anna Larrucea, Anne Curtis, Ara Mina, Aurora Sevilla, Bella Flores, Bing Loyzaga, Boots Anson-Roa, Caridad Sanchez, Carmi Martin, Carmina Villarroel, Celia Rodriguez, Charito Solis, Charlene Gonzales, Charo Santos-Concio, Cherry Pie Picache, Chin Chin Gutierrez, Cinema of the Philippines, Claudine Barretto, Cristina Gonzales, Daisy Reyes, Dawn Zulueta, Dennis Padilla, Dexter Doria, Dina Bonnevie, Donita Rose, Donna Cruz, Elizabeth Oropesa, Eva Darren, FAMAS Award, Fernando Poe Jr., Gawad Urian Award, Gelli de Belen, Gina Alajar, Gina Pareño, Gladys Reyes, Gloria Diaz, Gloria Romero (actress), Gloria Sevilla, Glydel Mercado, Gretchen Barretto, Isabel Granada, Jackie Lou Blanco, Jaclyn Jose, Janice de Belen, Jean Garcia, Jennifer Sevilla, Jolina Magdangal, Joyce Jimenez, Judy Ann Santos, Kris Aquino, Lady Lee, Lani Mercado, Laurice Guillen, Lea Salonga, Lilia Cuntapay, List of Philippine co-produced films and television series, List of Philippine films before 1940, List of Philippine films of 2011, List of Philippine films of 2012, List of Philippine films of 2013, List of Philippine films of 2014, List of Philippine films of 2015, List of Philippine films of 2016, List of Philippine films of 2017, List of Philippine films of 2018, List of Philippine films of 2019, List of Philippine films of 2020, List of Philippine films of the 1940s, List of Philippine films of the 1950s, List of Philippine films of the 1960s, List of Philippine films of the 1970s, List of Philippine films of the 1980s, List of Philippine films of the 2010s, List of Philippine submissions for the Academy Award for Best International Feature Film, List of highest-grossing films in the Philippines, List of people who won the Philippine movie grand slam, Lists of Philippine films, Lorna Tolentino, Lotlot de Leon, Lovely Rivero, Lucita Soriano, Luna Award, Manilyn Reynes, Maria Isabel Lopez, Marianne dela Riva, Maricel Laxa, Marita Zobel, Maritoni Fernandez, Melissa Mendez, Michael de Mesa, Mickey Ferriols, Music of the Philippines, Nanette Medved, Nida Blanca, Nikka Valencia, Nova Villa, Paula Peralejo, Perla Bautista, Philippines, Princess Punzalan, Rebecca Lusterio, Regine Velasquez, Rita Avila, Rosanna Roces, Ruby Rodriguez, Rufa Mae Quinto, Ruffa Gutierrez, Serena Dalrymple, Shaina Magdayao, Sharon Cuneta, Sheryl Cruz, Snooky Serna, Sunshine Cruz, Sunshine Dizon, Sylvia Sanchez, Tetchie Agbayani, Vilma Santos, Vina Morales, Vivian Velez, Young Critics Circle, Zsa Zsa Padilla, 
Nanette Medved,2,Alma Moreno, Compañero y Compañera, 
Asawa Ko  Karibal Ko,5,Alma Moreno, Analyn Barro, Kyline Alcantara, Lotlot de Leon, Thea Tolentino, 
Aira Bermudez,3,It's Showtime (Philippine TV program), Philippines, Rochelle Pangilinan, 
Jhoana Marie Tan,1,Philippines, 
Make It with You (TV series),9,Candy Pangilinan, Cindy Kurleto, Four Sisters and a Wedding, Liza Soberano, On the Wings of Love (TV series), One More Chance (2007 film), Philippines, Pokwang, The Hows of Us, 
Nicole Dulalia,1,Philippines, 
Susan Africa,3,Babaeng Hampaslupa, Philippines, The Hows of Us, 
Huwag Kang Mangamba,13,Andrea del Rosario, Angeline Quinto, Di Na Muli, Dimples Romana, Eula Valdez, It's Showtime (Philippine TV program), Jane Oineza, Matet de Leon, Mercedes Cabral, Mylene Dizon, Seth Fedelin, Sylvia Sanchez, Vivoree Esclito, 
Carol Banawa,0,
Relaks  It's Just Pag-ibig,3,Alessandra De Rossi, On the Wings of Love (TV series), Philippines, 
List of awards and nominations received by Nora Aunor,65,Ai-Ai delas Alas, Aleck Bovick, Amalia Fuentes, Andi Eigenmann, Angelica Panganiban, Anita Linda, Anne Curtis, Ara Mina, Assunta De Rossi, Barbara Perez, Boots Anson-Roa, Carla Abellana, Carmen Rosales, Celia Rodriguez, Charito Solis, Cherry Pie Picache, Claudine Barretto, Coney Reyes, Dawn Zulueta, Diana Zubiri, Dina Bonnevie, Elizabeth Oropesa, Eugene Domingo, Eula Valdez, FAMAS Award, Fernando Poe Jr., Gelli de Belen, Gina Alajar, Gina Pareño, Gloria Romero (actress), Gloria Sevilla, Hilda Koronel, Irma Adlawan, Jaclyn Jose, Janice de Belen, Janine Gutierrez, Jennylyn Mercado, Judy Ann Santos, KC Concepcion, Laurice Guillen, Liza Lorena, Lolita Rodriguez, Lorna Tolentino, Lovi Poe, Marlene Daudén, Melanie Marquez, Mylene Dizon, Nadine Lustre, Nena Cardenas, Nida Blanca, One More Try (film), Paraluman, Perla Bautista, Philippines, Rosa Rosal, Rosanna Roces, Sarah Geronimo, Sharon Cuneta, Snooky Serna, Tawag ng Tanghalan, Vilma Santos, Vivian Velez, When the Love Is Gone, Young Critics Circle, Zsa Zsa Padilla, 
Anna Larrucea,3,FAMAS Award, Lorna Tolentino, Sunshine Dizon, 
Vilma Santos,108,Ai-Ai delas Alas, Aleck Bovick, Alma Moreno, Alona Alegre, Amalia Fuentes, Amy Perez, Ana Capri, Andi Eigenmann, Angelica Panganiban, Anita Linda, Anne Curtis, Antoinette Taus, Ara Mina, Armida Siguion-Reyna, Aruray, Assunta De Rossi, Barbara Perez, Bella Flores, Bing Loyzaga, Boots Anson-Roa, Candy Pangilinan, Caridad Sanchez, Carmen Rosales, Carmi Martin, Celia Rodriguez, Chanda Romero, Charito Solis, Cherry Pie Picache, Claudine Barretto, Coney Reyes, Daisy Romualdez, Dawn Zulueta, Dexter Doria, Dimples Romana, Dina Bonnevie, Elizabeth Oropesa, Etang Discher, Eula Valdez, Eva Darren, FAMAS Award, Fernando Poe Jr., Filipinos, Gelli de Belen, Gina Alajar, Gina Pareño, Gloria Romero (actress), Gloria Sevilla, Gretchen Barretto, Hazel Ann Mendoza, Hilda Koronel, Irma Adlawan, Jaclyn Jose, Janice de Belen, Janine Gutierrez, Jean Garcia, Jennylyn Mercado, Jim Paredes, Jodi Sta. Maria, Judy Ann Santos, Juvy Cachola, KC Concepcion, Karylle, Katy de la Cruz, Kris Aquino, Laurice Guillen, Lilia Dizon, Liza Lorena, Lolita Rodriguez, Lorna Tolentino, Lovi Poe, Lucita Soriano, Marissa Delgado, Maritoni Fernandez, Marlene Daudén, Mary Walter, Matimtiman Cruz, Melanie Marquez, Metring David, Michael de Mesa, Mila del Sol, Mylene Dizon, Nadine Lustre, Nena Cardenas, Nida Blanca, Nikki Valdez, One More Try (film), Paraluman, Perla Bautista, Pokwang, Raquel Monteza, Rita Avila, Rosa Mia, Rosa Rosal, Rosanna Roces, Rosemarie Sonora, Ruby Moreno, Ruby Rodriguez, Rufa Mae Quinto, Sandy Andolong, Serena Dalrymple, Sharon Cuneta, Sheryl Cruz, Snooky Serna, Sofia Moran, Vivian Velez, Xian Lim, Zeny Zabala, Zsa Zsa Padilla, 
Maika Rivera,5,Arci Muñoz, Gelli de Belen, Gerald Anderson, It's Showtime (Philippine TV program), Philippines, 
Geoff Eigenmann,6,Andi Eigenmann, Carla Abellana, Gina Alajar, Maxene Magalona, Michael de Mesa, Philippines, 
Jodi Sta. Maria,29,Ai-Ai delas Alas, Anak (film), Anne Curtis, Brenna Garcia, Charee Pineda, Coney Reyes, Eda Nolan, Eula Valdez, Filipinos, Gawad Urian Award, Gladys Reyes, Gloria Diaz, Isabel Blaesi, Janelle Quintana, Janine Berdin, KC Concepcion, Kris Aquino, Kyline Alcantara, Maricel Laxa, Marla Boyd, Melissa Ricks, Michelle Madrigal, Pangako Sa 'Yo (2015 TV series), Paw Diaz, Roxanne Guinoo, Ruffa Gutierrez, Sharlene San Pedro, Vina Morales, Xyriel Manabat, 
List of Filipino male actors,67,Aljur Abrenica, Aring Bautista, Cinema of the Philippines, Dennis Padilla, FAMAS Award, Fernando Poe Jr., Gawad Urian Award, Geoff Eigenmann, Gerald Anderson, Jim Paredes, Jon Hernandez, List of Afghans, List of Armenian actors, List of Azerbaijani actors, List of Bangladeshi actors, List of Bhutanese actors, List of Chinese actors, List of Chinese actresses, List of Filipino actresses, List of Indian film actresses, List of Iranian actresses, List of Iranian male actors, List of Israeli actors, List of Japanese actors, List of Jordanian actors, List of Malaysian actors, List of Nepalese actors, List of North Korean actors, List of Philippine co-produced films and television series, List of Philippine films before 1940, List of Philippine films of 2011, List of Philippine films of 2012, List of Philippine films of 2013, List of Philippine films of 2014, List of Philippine films of 2015, List of Philippine films of 2016, List of Philippine films of 2017, List of Philippine films of 2018, List of Philippine films of 2019, List of Philippine films of 2020, List of Philippine films of the 1940s, List of Philippine films of the 1950s, List of Philippine films of the 1960s, List of Philippine films of the 1970s, List of Philippine films of the 1980s, List of Philippine films of the 1990s, List of Philippine films of the 2010s, List of Philippine submissions for the Academy Award for Best International Feature Film, List of Sri Lankan actors, List of Taiwanese actresses, List of Thai actresses, List of Thai male actors, List of Turkish actors, List of Uzbekistani film actors, List of Vietnamese actors, List of highest-grossing films in the Philippines, List of people who won the Philippine movie grand slam, Lists of Indian actors, Lists of Philippine actors, Lists of Philippine films, Luna Award, Michael de Mesa, Philippines, Rico J. Puno, StarStruck (season 5), Xian Lim, Young Critics Circle, 
Bangs Garcia,3,Cindy Kurleto, Philippines, Roxanne Guinoo, 
Mika dela Cruz,3,Angelika Dela Cruz, Daddy's Gurl, Pamilya Roces, 
List of Thai male actors,26,List of Afghans, List of Armenian actors, List of Azerbaijani actors, List of Bangladeshi actors, List of Bhutanese actors, List of Chinese actors, List of Chinese actresses, List of Filipino actresses, List of Filipino male actors, List of Indian film actresses, List of Iranian actresses, List of Iranian male actors, List of Israeli actors, List of Japanese actors, List of Jordanian actors, List of Malaysian actors, List of Nepalese actors, List of North Korean actors, List of Sri Lankan actors, List of Taiwanese actresses, List of Thai actresses, List of Turkish actors, List of Uzbekistani film actors, List of Vietnamese actors, Lists of Indian actors, Lists of Philippine actors, 
Mayton Eugenio,2,100 Tula Para Kay Stella, Philippines, 
Dely Atay-Atayan,1,Philippines, 
Rochelle Pangilinan,8,Aira Bermudez, Beauty Gonzalez, Carmina Villarroel, Darna (2009 TV series), Erika Padilla, Jolina Magdangal, Judy Ann Santos, Philippines, 
Caral,0,
Rico J. Puno,7,Filipinos, It's Showtime (Philippine TV program), Kris Aquino, Kuh Ledesma, Philippines, Pilipinas Win Na Win, Pokwang, 
Pornographic film actor,0,
