List of Filipino actresses,559,AC Bonifacio, Ai-Ai delas Alas, Aicelle Santos, Aiko Climaco, Aira Bermudez, Aleck Bovick, Alessandra De Rossi, Alex Gonzaga, Alexa Ilacad, Alicia Mayer, Alma Moreno, Alodia Gosiengfiao, Alona Alegre, Alyssa Alano, Amalia Fuentes, Amy Perez, Ana Capri, Ana Roces, Analyn Barro, Andi Eigenmann, Andrea Torres, Andrea del Rosario, Angeli Gonzales, Angeli Nicole Sanoy, Angelica Panganiban, Angelika Dela Cruz, Angeline Quinto, Angelu de Leon, Anita Linda, Anja Aguilar, Ann Li, Anna Fegi, Anna Larrucea, Anna Luna (actress), Anna Marie Gutierrez, Annabelle Rama, Anne Curtis, Antoinette Taus, Ara Mina, Arci Muñoz, Aria Clemente, Ariana Barouk, Ariella Arida, Aring Bautista, Armida Siguion-Reyna, Arny Ross, Arra San Agustin, Aruray, Asia Agcaoili, Athena Tibi, Aubrey Miles, Aurora Sevilla, Ayen Munji-Laurel, Bangs Garcia, Barbara Miguel, Barbara Perez, Barbie Forteza, Barbie Imperial, Bea Binene, Bea Nicolas, Bea Saw, Beauty Gonzalez, Bella Flores, Bettina Carlos, Beverly Vergel, Bianca King, Bianca Manalo, Bianca Umali, Bing Loyzaga, Bituin Escalante, Boots Anson-Roa, Brenna Garcia, Bubbles Paraiso, Candy Pangilinan, Caridad Sanchez, Carina Afable, Carla Abellana, Carlene Aguilar, Carmen Rosales, Carmencita Abad, Carmi Martin, Carmina Villarroel, Carol Banawa, Cassandra Ponti, Celeste Legaspi, Celia Rodriguez, Ces Quesada, Chanda Romero, Charee Pineda, Charito Solis, Charlene Gonzales, Cherry Lou, Cherry Pie Picache, Cheska Garcia, Chin Chin Gutierrez, Chlaui Malayao, Christine Jacob, Ciara Sotto, Cielito del Mundo, Cindy Kurleto, Cinema of the Philippines, Claudia Zobel, Claudine Barretto, Coleen Perez, Coney Reyes, Cris Villonco, Cristina Gonzales, Cynthia Zamora, Daisy Reyes, Daisy Romualdez, Danita Paner, Dasuri Choi, Dawn Zulueta, Dely Atay-Atayan, Denise Barbacena, Denise Joaquin, Denise Laurel, Dexter Doria, Diana Zubiri, Dianne Medina, Dianne dela Fuente, Didith Reyes, Dimples Romana, Dina Bonnevie, Dionne Monsanto, Donita Rose, Donna Cruz, Dulce (Filipino singer), Eda Nolan, Elaine Duran, Elha Nympha, Elijah Alejo, Elise Estrada, Elisse Joson, Elizabeth Cooper, Elizabeth Oropesa, Elizabeth Ramsey, Ella Cruz, Ella Guevara, Elle Ramirez, Ellen Adarna, Emma Alegre, Emma Henry, Emmanuelle Vera, Empress Schuck, Erika Padilla, Esang de Torres, Etang Discher, Eugene Domingo, Eula Caballero, Eula Valdez, Eunice Lagusad, Eva Castillo, Eva Darren, Eva Eugenio, Evangeline Pascual, FAMAS Award, Frances Makil-Ignacio, Franchesca Salcedo, Francine Prieto, Frencheska Farr, G. Toengi, Gawad Urian Award, Gee-Ann Abrahan, Gelli de Belen, Gem Ramos, Geneva Cruz, Georgina Wilson, Geraldine Ecleo-Villaroman, Gina Alajar, Gina Pareño, Gladys Reyes, Gloria Diaz, Gloria Romero (actress), Gloria Sevilla, Glydel Mercado, Grace Lee, Gretchen Barretto, Gwen Zamora, Halina Perez, Harlene Bautista, Hazel Ann Mendoza, Heaven Peralejo, Helen Vela, Helga Krapf, Herlene Budol, Hilda Koronel, Hiyasmin Neri, Ian Galliguez, Imelda Schweighart, Ina Feleo, Ina Raymundo, Inday Badiday, Irma Adlawan, Isabel Blaesi, Isabel Granada, Isabel Oli, Isabel Rivas, Ivana Alawi, Iwa Moto, Jackie Lou Blanco, Jackie Rice, Jaclyn Jose, Jade Lopez, Jan Marini, Jana Roxas, Jane De Leon, Jane Oineza, Janella Salvador, Janelle Quintana, Janice de Belen, Janina San Miguel, Janine Berdin, Janine Gutierrez, Janine Tugonon, Janna Dominguez, January Isaac, Jasmine Curtis-Smith, Jaya (singer), Jaymee Joaquin, Jazz Ocampo, Jean Garcia, Jed Montero, Jef Gaitan, Jennica Garcia, Jennifer Sevilla, Jenny Miller, Jennylyn Mercado, Jessy Mendiola, Jewel Mische, Jhoana Marie Tan, Jillian Ward, Jinri Park, Jo Berry (actress), Jodi Sta. Maria, Jolina Magdangal, Joy Viado, Joyce Jimenez, Judy Ann Santos, Julia Clarete, Julia Montes, Julie Anne San Jose, Justina David, Juvy Cachola, KC Concepcion, KZ Tandingan, Kaori Oinuma, Karel Marquez, Karen delos Reyes, Karla Estrada, Karylle, Kat Alano, Kate Valdez, Kathleen Hermosa, Katrina Halili, Katy de la Cruz, Kim Molina, Kim Rodriguez, Kiray, Kisses Delavin, Kitchie Nadal, Kitkat (comedian), Koreen Medina, Kris Aquino, Krista K, Krista Ranillo, Kristel Fulgar, Kristel Moreno, Kristina Paner, Krizza Neri, Krystal Reyes, Kuh Ledesma, Kylie Verzosa, Kyline Alcantara, Lady Lee, Lana Jalosjos, Lani Mercado, Lani Misalucha, Lauren Young, Laurice Guillen, Lea Salonga, Leanne Bautista, Letty Alonzo, Lexi Fernandez, Lilia Cuntapay, Lilia Dizon, Linda Estrella, Linn Oeymo, List of Afghans, List of Armenian actors, List of Azerbaijani actors, List of Bangladeshi actors, List of Bhutanese actors, List of Chinese actors, List of Chinese actresses, List of Filipino male actors, List of Indian film actresses, List of Iranian actresses, List of Iranian male actors, List of Israeli actors, List of Japanese actors, List of Jordanian actors, List of Malaysian actors, List of Nepalese actors, List of North Korean actors, List of Philippine co-produced films and television series, List of Philippine films before 1940, List of Philippine films of 2011, List of Philippine films of 2012, List of Philippine films of 2013, List of Philippine films of 2014, List of Philippine films of 2015, List of Philippine films of 2016, List of Philippine films of 2017, List of Philippine films of 2018, List of Philippine films of 2019, List of Philippine films of 2020, List of Philippine films of the 1940s, List of Philippine films of the 1950s, List of Philippine films of the 1960s, List of Philippine films of the 1970s, List of Philippine films of the 1980s, List of Philippine films of the 1990s, List of Philippine films of the 2010s, List of Philippine submissions for the Academy Award for Best International Feature Film, List of Sri Lankan actors, List of Taiwanese actresses, List of Thai actresses, List of Thai male actors, List of Turkish actors, List of Uzbekistani film actors, List of Vietnamese actors, List of highest-grossing films in the Philippines, List of people who won the Philippine movie grand slam, Lists of Indian actors, Lists of Philippine actors, Lists of Philippine films, Liz Alindogan, Liza Diño, Liza Lorena, Liza Soberano, Lolit Solis, Lolita Rodriguez, Lorna Tolentino, Lota Delgado, Lotlot de Leon, Lougee Basabas, Louise delos Reyes, Lovely Abella, Lovely Rivero, Lovi Poe, Luane Dy, Lucita Soriano, Luna Award, Luz Valdez, Lyca Gairanod, Madam Auring, Maey Bautista, Mahal (actress), Maika Rivera, Manilyn Reynes, Mara Lopez, Maria Amapola Cabase, Maria Isabel Lopez, Maria Teresa Carlson, Marianne dela Riva, Maricar Reyes, Maricar de Mesa, Maricel Laxa, Mariel Pamintuan, Marissa Delgado, Marita Zobel, Maritoni Fernandez, Mariz (actress), Marjorie Barretto, Marla Boyd, Marlann Flores, Mary Jean Lastimosa, Mary Walter, Matet de Leon, Matimtiman Cruz, Maui Taylor, Maureen Larrazabal, Maureen Wroblewitz, Max Collins (actress), Maxene Magalona, Maxine Medina, Maybelyn dela Cruz, Maymay Entrata, Mayton Eugenio, Meg Imperial, Megan Young, Melai Cantiveros, Melanie Marquez, Melissa Mendez, Melissa Ricks, Mely Tagasa, Mercedes Cabral, Metring David, Mich Dulce, Michelle Madrigal, Michelle van Eimeren, Mickey Ferriols, Miho Nishida, Mikee Cojuangco-Jaworski, Mikee Quintos, Mila del Sol, Miles Ocampo, Miriam Quiambao, Moira Dela Torre, Mona Louise Rey, Mosang, Mutya Orquia, Mylene Dizon, Myrtle Sarrosa, Nadine Lustre, Nadine Samonte, Nanette Medved, Naty Bernardo, Nena Cardenas, Nene Tamayo, Nicole Dulalia, Nicole Uysiuseng, Nida Blanca, Nikka Valencia, Nikki Bacolod, Nikki Valdez, Nina Girado, Nina Kodaka, Niña Dolino, Niña Jose, Nori Dalisay, Nova Villa, Paraluman, Patricia Fernandez (actress), Patricia Tumulak, Paula Peralejo, Pauline Mendoza, Paw Diaz, Perla Bautista, Philippines, Pia Guanio, Pia Moran, Pinky Amador, Pinoy Big Brother: Otso, Pokwang, Pops Fernandez, Precious Lara Quigaman, Princess Guevarra, Princess Punzalan, Princess Ryan, RR Enriquez, Rabiya Mateo, Rachel Alejandro, Radha Cuadrado, Raquel Monteza, Raven Villanueva, Rebecca Lusterio, Regine Angeles, Regine Tolentino, Regine Velasquez, Rhian Ramos, Ria Atayde, Rica Peralejo, Rich Asuncion, Rio Diaz, Rio Locsin, Rita Avila, Ritz Azul, Riza Santos, Rochelle Pangilinan, Rosa Mia, Rosa Rosal, Rosa del Rosario, Roselle Nava, Rosemarie Sonora, Rox Montealegre, Roxanne Barcelo, Roxanne Guinoo, Ruby Moreno, Ruby Rodriguez, Rufa Mae Quinto, Rufa Mi, Ruffa Gutierrez, Ryza Cenon, Ryzza Mae Dizon, Saab Magalona, Sabrina Man, Sam Bumatay, Sam Pinto, Sandy Andolong, Sandy Talag, Sanya Lopez, Sarah Geronimo, Sarah Lahbati, Serena Dalrymple, Shaina Magdayao, Shaira Diaz, Shamaine Buencamino, Sharlene San Pedro, Sharmaine Arnaiz, Sharon Cuneta, Sheena Halili, Sheree Bautista, Shermaine Santiago, Sheryl Cruz, Sheryn Regis, Shine Kuk, Shy Carlos, Snooky Serna, Sofia Moran, Sofie Garrucho, Solenn Heussaff, Sophia Montecarlo, Sophie Albert, Stephanie Sol, Sue Prado, Sue Ramirez, Sugar Mercado, Sunshine Cruz, Sunshine Dizon, Susan Africa, Suzette Ranillo, Sylvia La Torre, Sylvia Sanchez, Taki Saito, Tanya Garcia, Tessie Agana, Tetchie Agbayani, Thea Tolentino, Therese Malvar, Tita Muñoz, Tiya Pusit, Toni Rose Gayda, Valeen Montenegro, Valerie Weigmann, Vaness del Moral, Venus Raj, Verna Gaston, Vickie Rushton, Vilma Santos, Vina Morales, Vivian Velez, Vivoree Esclito, Wendy Valdez, Xyriel Manabat, Yasmien Kurdi, Yayo Aguila, Yen Santos, Yeng Constantino, Yesha Camile, Ylona Garcia, Ynna Asistio, Young Critics Circle, Zeny Zabala, Zephanie Dimaranan, Zia Marquez, Zia Quizon, Zsa Zsa Padilla, 
Rio Diaz,4,Eula Valdez, Georgina Wilson, Gloria Diaz, Philippines, 
Nikki Bacolod,1,Philippines, 
Rio Locsin,5,Dolce Amore, Philippines, Temptation of Wife (2012 TV series), Vilma Santos, Working Girls (2010 film), 
Ruffa Gutierrez,27,Ai-Ai delas Alas, Annabelle Rama, Anne Curtis, Brenna Garcia, Charee Pineda, Eda Nolan, Eula Valdez, Gladys Reyes, Gloria Diaz, Isabel Blaesi, It's Showtime (Philippine TV program), Janelle Quintana, Janine Berdin, KC Concepcion, Kyline Alcantara, Maricel Laxa, Marla Boyd, Melissa Ricks, Michelle Madrigal, Paw Diaz, Philippines, Roxanne Guinoo, Sharlene San Pedro, Snooky Serna, Vina Morales, Working Girls (2010 film), Xyriel Manabat, 
Antoinette Taus,3,Bridges of Love, Filipinos, Philippines, 
Jackie Rice,6,Bea Binene, Darna (2009 TV series), Filipinos, Jewel Mische, Philippines, Ryza Cenon, 
Kakai Bautista,2,Crazy Beautiful You, Daddy's Gurl, 
List of highest-grossing films in the Philippines,25,Cinema of the Philippines, FAMAS Award, Gawad Urian Award, List of Philippine co-produced films and television series, List of Philippine films before 1940, List of Philippine films of 2014, List of Philippine films of 2015, List of Philippine films of 2016, List of Philippine films of 2017, List of Philippine films of 2018, List of Philippine films of 2019, List of Philippine films of the 1940s, List of Philippine films of the 1950s, List of Philippine films of the 1960s, List of Philippine films of the 1970s, List of Philippine films of the 1980s, List of Philippine films of the 1990s, List of Philippine films of the 2010s, List of Philippine submissions for the Academy Award for Best International Feature Film, List of people who won the Philippine movie grand slam, Lists of Philippine films, Luna Award, Philippines, The Hows of Us, Young Critics Circle, 
Sylvia Sanchez,5,Eula Valdez, Huwag Kang Mangamba, Pangako Sa 'Yo (2015 TV series), Pure Love (2014 TV series), Ria Atayde, 
List of Chinese actresses,26,List of Afghans, List of Armenian actors, List of Azerbaijani actors, List of Bangladeshi actors, List of Bhutanese actors, List of Chinese actors, List of Filipino actresses, List of Filipino male actors, List of Indian film actresses, List of Iranian actresses, List of Iranian male actors, List of Israeli actors, List of Japanese actors, List of Jordanian actors, List of Malaysian actors, List of Nepalese actors, List of North Korean actors, List of Sri Lankan actors, List of Taiwanese actresses, List of Thai actresses, List of Thai male actors, List of Turkish actors, List of Uzbekistani film actors, List of Vietnamese actors, Lists of Indian actors, Lists of Philippine actors, 
Shamcey Supsup-Lee,15,Anne Curtis, Ariella Arida, Bianca Manalo, Charlene Gonzales, Gloria Diaz, Janine Tugonon, Joanne Santos-Quintas, Maria Isabel Lopez, Mary Jean Lastimosa, Maxine Medina, Miriam Quiambao, Philippines, Rabiya Mateo, Rosario Silayan-Bailon, Venus Raj, 
Alicia Mayer,2,Extra Challenge, Philippines, 
Zia Quizon,3,Karylle, Lorna Tolentino, Zsa Zsa Padilla, 
Janine Tugonon,15,Ariella Arida, Bianca Manalo, Charlene Gonzales, Gloria Diaz, Joanne Santos-Quintas, Kris Aquino, Maria Isabel Lopez, Mary Jean Lastimosa, Maxine Medina, Miriam Quiambao, Philippines, Rabiya Mateo, Rosario Silayan-Bailon, Shamcey Supsup-Lee, Venus Raj, 
List of Cambodian film actors,27,List of Afghans, List of Armenian actors, List of Azerbaijani actors, List of Bangladeshi actors, List of Bhutanese actors, List of Chinese actors, List of Chinese actresses, List of Filipino actresses, List of Filipino male actors, List of Indian film actresses, List of Iranian actresses, List of Iranian male actors, List of Israeli actors, List of Japanese actors, List of Jordanian actors, List of Malaysian actors, List of Nepalese actors, List of North Korean actors, List of Sri Lankan actors, List of Taiwanese actresses, List of Thai actresses, List of Thai male actors, List of Turkish actors, List of Uzbekistani film actors, List of Vietnamese actors, Lists of Indian actors, Lists of Philippine actors, 
Cynthia Zamora,1,Filipinos, 
Zsa Zsa Padilla,39,Ai-Ai delas Alas, Amy Perez, Anita Linda, Anne Curtis, Ara Mina, Assunta De Rossi, Charito Solis, Cherry Pie Picache, Coney Reyes, Dawn Zulueta, Elizabeth Oropesa, Eula Valdez, Filipinos, Gelli de Belen, Gina Alajar, Gina Pareño, Gloria Romero (actress), Hilda Koronel, Irma Adlawan, It's Showtime (Philippine TV program), Jaclyn Jose, Jennylyn Mercado, Judy Ann Santos, Karylle, Laurice Guillen, Liza Lorena, Lolita Rodriguez, Lorna Tolentino, Melanie Marquez, Mylene Dizon, Nadine Lustre, Nida Blanca, One More Try (film), Rosanna Roces, Sharon Cuneta, Tawag ng Tanghalan, Vilma Santos, Vivian Velez, Zia Quizon, 
Laurice Guillen,27,A Dangerous Life, Ai-Ai delas Alas, Anne Curtis, Ara Mina, Assunta De Rossi, Charito Solis, Coney Reyes, Dawn Zulueta, Elizabeth Oropesa, Gina Alajar, Gloria Romero (actress), Hilda Koronel, Ina Feleo, Irma Adlawan, Jennylyn Mercado, Judy Ann Santos, Kris Aquino, Liza Lorena, Lolita Rodriguez, Lorna Tolentino, Melanie Marquez, One More Try (film), Philippines, Sharon Cuneta, Vilma Santos, Vivian Velez, Zsa Zsa Padilla, 
Mary Walter,3,Elizabeth Cooper, Katy de la Cruz, Philippines, 
Krystal Reyes,4,Barbie Forteza, Ella Guevara, Philippines, Tween Academy: Class of 2012, 
Sakada (1976 film),5,Gawad Urian Award, Gloria Romero (actress), Hilda Koronel, Philippines, Rosa Rosal, 
Tween Academy: Class of 2012,12,Barbie Forteza, Bea Binene, Ellen Adarna, Frencheska Farr, Julie Anne San Jose, Lexi Fernandez, Louise delos Reyes, Pinky Amador, Sam Pinto, Sarah Lahbati, Yayo Aguila, Ynna Asistio, 
Candy Pangilinan,26,Andi Eigenmann, Anne Curtis, Ara Mina, Claudine Barretto, Eugene Domingo, Fernando Poe Jr., Geoff Eigenmann, Gerald Anderson, Gina Alajar, Gloria Romero (actress), Jodi Sta. Maria, Jolina Magdangal, Julia Montes, KC Concepcion, Kris Aquino, Liza Soberano, Make It with You (TV series), Mikee Cojuangco-Jaworski, Nadine Lustre, Nova Villa, Philippines, Pokwang, Regine Velasquez, Rufa Mae Quinto, Vina Morales, Xian Lim, 
Cherry Pie Picache,23,Anita Linda, Assunta De Rossi, Charito Solis, Elizabeth Oropesa, Eula Valdez, FAMAS Award, Gelli de Belen, Gina Alajar, Gina Pareño, Gloria Romero (actress), Jaclyn Jose, Judy Ann Santos, Lorna Tolentino, Mylene Dizon, Nadine Lustre, Nida Blanca, On the Wings of Love (TV series), Philippines, Rosanna Roces, Sharon Cuneta, Vilma Santos, Young Critics Circle, Zsa Zsa Padilla, 
Pinoy Big Brother: Teen Clash 2010,44,Aleck Bovick, Ann Li, Barbie Imperial, Bea Saw, Beauty Gonzalez, Cassandra Ponti, Dionne Monsanto, Elisse Joson, Empress Schuck, Fretzie Bercede, Gaby Dela Merced, Gee-Ann Abrahan, Gerald Anderson, Gladys Reyes, Heaven Peralejo, Jane Oineza, Jinri Park, KC Concepcion, Kaori Oinuma, Kisses Delavin, Maymay Entrata, Megan Young, Melai Cantiveros, Mich Dulce, Miho Nishida, Myrtle Sarrosa, Nene Tamayo, Nicole Uysiuseng, Niña Jose, Pinoy Big Brother: Otso, Pinoy Big Brother: Season 1, Pinoy Big Brother: Season 2, Riza Santos, Roxanne Barcelo, Sam Pinto, Seth Fedelin, Valerie Weigmann, Vickie Rushton, Vivoree Esclito, Wendy Valdez, Yayo Aguila, Yen Santos, Yeng Constantino, Ylona Garcia, 
Shy Carlos,3,Armida Siguion-Reyna, Filipinos, Nadine Lustre, 
Meg Imperial,3,Filipinos, Philippines, Ritz Azul, 
StarStruck (season 5),20,Aljur Abrenica, Arci Muñoz, Carla Abellana, Eula Valdez, Gina Alajar, Jackie Rice, Jennylyn Mercado, Jewel Mische, Jolina Magdangal, Katrina Halili, Lolit Solis, Lucy Torres-Gomez, Nina Kodaka, Philippines, Rox Montealegre, Ryza Cenon, Sarah Lahbati, StarStruck (season 4), Sunshine Dizon, Yasmien Kurdi, 
Gee-Ann Abrahan,43,Aleck Bovick, Ann Li, Barbie Imperial, Bea Saw, Beauty Gonzalez, Cassandra Ponti, Claudine Barretto, Dionne Monsanto, Elisse Joson, Fretzie Bercede, Gaby Dela Merced, Gerald Anderson, Gladys Reyes, Heaven Peralejo, Jane Oineza, Jinri Park, Judy Ann Santos, Kaori Oinuma, Kisses Delavin, Maymay Entrata, Megan Young, Melai Cantiveros, Mich Dulce, Miho Nishida, Myrtle Sarrosa, Nene Tamayo, Nicole Uysiuseng, Niña Jose, Pinoy Big Brother: Otso, Pinoy Big Brother: Season 1, Pinoy Big Brother: Season 2, Pinoy Big Brother: Teen Clash 2010, Riza Santos, Roxanne Barcelo, Sam Pinto, Seth Fedelin, Valerie Weigmann, Vickie Rushton, Vivoree Esclito, Wendy Valdez, Yayo Aguila, Yen Santos, Ylona Garcia, 
Sofie Garrucho,1,Philippines, 
Zephanie Dimaranan,16,Angeline Quinto, Donna Cruz, Elha Nympha, Esang de Torres, It's Showtime (Philippine TV program), Janine Berdin, Kuh Ledesma, Mikee Cojuangco-Jaworski, Moira Dela Torre, Philippines, Pinoy Big Brother: Otso, Regine Velasquez, Sarah Geronimo, Sharon Cuneta, Tawag ng Tanghalan, Yeng Constantino, 
Lilia Cuntapay,6,Artista Academy, Gawad Urian Award, It's Showtime (Philippine TV program), Kris Aquino, Maricar Reyes, Philippines, 
Nadine Lustre,66,Ai-Ai delas Alas, Aleck Bovick, Amalia Fuentes, Andi Eigenmann, Angelica Panganiban, Anita Linda, Anne Curtis, Ara Mina, Assunta De Rossi, Barbara Perez, Boots Anson-Roa, Carmen Rosales, Celia Rodriguez, Charito Solis, Cherry Pie Picache, Cindy Kurleto, Claudine Barretto, Dawn Zulueta, Diana Zubiri, Dina Bonnevie, Donita Rose, Elizabeth Oropesa, Eula Valdez, FAMAS Award, Gawad Urian Award, Gelli de Belen, Gina Alajar, Gina Pareño, Gloria Romero (actress), Gloria Sevilla, It's Showtime (Philippine TV program), Jaclyn Jose, Janine Gutierrez, Jennylyn Mercado, Jessy Mendiola, Judy Ann Santos, KC Concepcion, Katrina Halili, List of highest-grossing films in the Philippines, Liza Soberano, Lolita Rodriguez, Lorna Tolentino, Lovi Poe, Marlene Daudén, Music of the Philippines, Mylene Dizon, Myrtle Sarrosa, Nena Cardenas, Nida Blanca, On the Wings of Love (TV series), Paraluman, Perla Bautista, Philippines, Rosa Rosal, Rosanna Roces, Sam Pinto, Sharon Cuneta, Shy Carlos, Snooky Serna, Sunshine Cruz, Vilma Santos, Vivian Velez, When the Love Is Gone, Yeng Constantino, Young Critics Circle, Zsa Zsa Padilla, 
List of Philippine films of the 2010s,30,1984 in the Philippines, Cinema of the Philippines, FAMAS Award, Gawad Urian Award, List of Philippine co-produced films and television series, List of Philippine films before 1940, List of Philippine films of 2011, List of Philippine films of 2012, List of Philippine films of 2013, List of Philippine films of 2014, List of Philippine films of 2015, List of Philippine films of 2016, List of Philippine films of 2017, List of Philippine films of 2018, List of Philippine films of 2019, List of Philippine films of 2020, List of Philippine films of the 1940s, List of Philippine films of the 1950s, List of Philippine films of the 1960s, List of Philippine films of the 1970s, List of Philippine films of the 1980s, List of Philippine films of the 1990s, List of Philippine submissions for the Academy Award for Best International Feature Film, List of highest-grossing films in the Philippines, List of people who won the Philippine movie grand slam, Lists of Philippine films, Luna Award, Music of the Philippines, Philippines, Young Critics Circle, 
Bea Binene,2,Philippines, Tween Academy: Class of 2012, 
Iwa Moto,6,Darna (2009 TV series), Filipinos, Jackie Rice, Katrina Halili, Lovi Poe, Rich Asuncion, 
Nadine Samonte,2,Darna (2009 TV series), Dina Bonnevie, 
Jade Lopez,2,Filipinos, Philippines, 
Karylle,8,Anne Curtis, It's Showtime (Philippine TV program), Lorna Tolentino, Regine Velasquez, Sarah Geronimo, Sharon Cuneta, Zia Quizon, Zsa Zsa Padilla, 
Tawag ng Tanghalan,21,Alex Gonzaga, Amy Perez, Angeline Quinto, Anne Curtis, Arci Muñoz, Dulce (Filipino singer), Elaine Duran, Filipinos, It's Showtime (Philippine TV program), Janine Berdin, Jaya (singer), Jolina Magdangal, Karla Estrada, Karylle, Nadine Lustre, Philippines, Rico J. Puno, Roxanne Barcelo, Sheree Bautista, Yeng Constantino, Zsa Zsa Padilla, 
Sarah Lahbati,4,Jewel Mische, Jolina Magdangal, Philippines, StarStruck (season 5), 
Alona Alegre,1,Philippines, 
Ria Atayde,8,Beauty Gonzalez, Coney Reyes, Halik (TV series), It's Showtime (Philippine TV program), Philippines, Pokwang, Sylvia Sanchez, The Hows of Us, 
Leanne Bautista,1,Filipinos, 
Rosa Mia,1,Philippines, 
Liz Alindogan,7,Anna Marie Gutierrez, Carmi Martin, Coney Reyes, Jodi Sta. Maria, Maria Isabel Lopez, Philippines, Xyriel Manabat, 
Emmanuelle Vera,12,Elha Nympha, Esang de Torres, Filipinos, KZ Tandingan, Karla Estrada, Lougee Basabas, Lyca Gairanod, Moira Dela Torre, Pangako Sa 'Yo (2015 TV series), Philippines, Rufa Mi, Zephanie Dimaranan, 
Julie Anne San Jose,9,Dasuri Choi, Dina Bonnevie, Donna Cruz, Frencheska Farr, Isabel Oli, Philippines, Pia Guanio, Sharon Cuneta, Tween Academy: Class of 2012, 
Elha Nympha,10,Emmanuelle Vera, Esang de Torres, Janine Berdin, Karla Estrada, Lougee Basabas, Lyca Gairanod, Moira Dela Torre, Philippines, Rufa Mi, Zephanie Dimaranan, 
Xyriel Manabat,24,Ai-Ai delas Alas, Anne Curtis, Brenna Garcia, Charee Pineda, Coney Reyes, Eda Nolan, Eula Valdez, Gladys Reyes, Gloria Diaz, Isabel Blaesi, It's Showtime (Philippine TV program), Janelle Quintana, Janine Berdin, KC Concepcion, Kyline Alcantara, Maricel Laxa, Marla Boyd, Melissa Ricks, Michelle Madrigal, Paw Diaz, Roxanne Guinoo, Ruffa Gutierrez, Sharlene San Pedro, Vina Morales, 
Barbara Miguel,0,
Bea Saw,41,Aleck Bovick, Ann Li, Barbie Imperial, Beauty Gonzalez, Cassandra Ponti, Dionne Monsanto, Elisse Joson, Fretzie Bercede, Gaby Dela Merced, Gee-Ann Abrahan, Gerald Anderson, Heaven Peralejo, Jane Oineza, Jinri Park, Kaori Oinuma, Kisses Delavin, Maymay Entrata, Megan Young, Melai Cantiveros, Mich Dulce, Miho Nishida, Myrtle Sarrosa, Nene Tamayo, Nicole Uysiuseng, Niña Jose, One More Chance (2007 film), Pinoy Big Brother: Otso, Pinoy Big Brother: Season 1, Pinoy Big Brother: Season 2, Pinoy Big Brother: Teen Clash 2010, Riza Santos, Roxanne Barcelo, Sam Pinto, Seth Fedelin, Valerie Weigmann, Vickie Rushton, Vivoree Esclito, Wendy Valdez, Yayo Aguila, Yen Santos, Ylona Garcia, 
Ella Guevara,2,Darna (2009 TV series), Philippines, 
1984 in the Philippines,24,1984 in the Philippines, Aleck Bovick, Alessandra De Rossi, Anna Larrucea, Bubbles Paraiso, Claudia Zobel, Dimples Romana, Jaymee Joaquin, Karen delos Reyes, Krista Ranillo, List of Philippine films before 1940, List of Philippine films of 2018, List of Philippine films of 2019, List of Philippine films of 2020, List of Philippine films of the 1940s, List of Philippine films of the 1950s, List of Philippine films of the 1960s, List of Philippine films of the 1970s, List of Philippine films of the 1980s, List of Philippine films of the 1990s, List of Philippine films of the 2010s, Music of the Philippines, Paula Peralejo, Philippines, 
Isabel Oli,4,Bridges of Love, It's Showtime (Philippine TV program), Lorna Tolentino, Philippines, 
Tetchie Agbayani,4,Dolce Amore, Nang Ngumiti ang Langit, Philippines, Pure Love (2014 TV series), 
Extra Challenge,2,Miriam Quiambao, Phoemela Baranda, 
List of Turkish actors,26,List of Afghans, List of Armenian actors, List of Azerbaijani actors, List of Bangladeshi actors, List of Bhutanese actors, List of Chinese actors, List of Chinese actresses, List of Filipino actresses, List of Filipino male actors, List of Indian film actresses, List of Iranian actresses, List of Iranian male actors, List of Israeli actors, List of Japanese actors, List of Jordanian actors, List of Malaysian actors, List of Nepalese actors, List of North Korean actors, List of Sri Lankan actors, List of Taiwanese actresses, List of Thai actresses, List of Thai male actors, List of Uzbekistani film actors, List of Vietnamese actors, Lists of Indian actors, Lists of Philippine actors, 
A Dangerous Life,5,Celeste Legaspi, Dina Bonnevie, Kris Aquino, Laurice Guillen, Philippines, 
Miles Ocampo,8,Angelica Panganiban, Filipinos, Gerald Anderson, Lorna Tolentino, One Great Love (film), Sarah Geronimo, Sharlene San Pedro, Sharon Cuneta, 
