Dina Bonnevie,40,A Dangerous Life, Ai-Ai delas Alas, Aleck Bovick, Amalia Fuentes, Andi Eigenmann, Angelica Panganiban, Anita Linda, Anne Curtis, Ara Mina, Barbara Perez, Boots Anson-Roa, Carmen Rosales, Celia Rodriguez, Charito Solis, Claudine Barretto, Dawn Zulueta, Elizabeth Oropesa, FAMAS Award, Gawad Urian Award, Gloria Romero (actress), Gloria Sevilla, Janine Gutierrez, Judy Ann Santos, KC Concepcion, Lolita Rodriguez, Lorna Tolentino, Lovi Poe, Marlene Daudén, Nadine Lustre, Nena Cardenas, Nida Blanca, Paraluman, Perla Bautista, Philippines, Rosa Rosal, Sharon Cuneta, Snooky Serna, Vilma Santos, Vivian Velez, When the Love Is Gone, 
Rosemarie Sonora,3,Gina Pareño, Philippines, Sheryl Cruz, 
Melanie Marquez,37,Ai-Ai delas Alas, Anne Curtis, Ara Mina, Assunta De Rossi, Cassandra Ponti, Chanda Romero, Charito Solis, Charlene Gonzales, Coney Reyes, Daddy's Gurl, Dawn Zulueta, Elizabeth Oropesa, Gina Alajar, Gloria Diaz, Gloria Romero (actress), Hilda Koronel, Irma Adlawan, Janina San Miguel, Jennylyn Mercado, Judy Ann Santos, Kylie Verzosa, Laurice Guillen, Liza Lorena, Lolita Rodriguez, Megan Young, Miriam Quiambao, One More Try (film), Philippines, Precious Lara Quigaman, Ruffa Gutierrez, Sharmaine Arnaiz, Sharon Cuneta, Venus Raj, Vilma Santos, Vivian Velez, Zia Marquez, Zsa Zsa Padilla, 
Liza Diño,6,Angelica Panganiban, Ara Mina, Aubrey Miles, Gawad Urian Award, Ice Seguerra, Philippines, 
Kim Rodriguez,4,Filipinos, Isabel Granada, Judy Ann Santos, Philippines, 
Kristina Paner,25,Angelica Panganiban, Angelu de Leon, Ara Mina, Daisy Romualdez, Danita Paner, Dennis Padilla, Gladys Reyes, Gloria Romero (actress), Isabelle de Leon, It's Showtime (Philippine TV program), Iwa Moto, Jolina Magdangal, Julie Anne San Jose, Kate Valdez, Kitkat (comedian), Lea Salonga, Lorna Tolentino, Manilyn Reynes, Philippines, Rachel Alejandro, Regine Velasquez, Rico J. Puno, Sarah Geronimo, Sharon Cuneta, Sheryl Cruz, 
Janella Salvador,2,Filipinos, Moira Dela Torre, 
Rich Asuncion,3,Iwa Moto, Philippines, StarStruck (season 4), 
Luna Award,25,Boots Anson-Roa, Cinema of the Philippines, Claudine Barretto, FAMAS Award, Gawad Urian Award, Gina Alajar, Jolina Magdangal, Lani Mercado, List of Philippine co-produced films and television series, List of Philippine films before 1940, List of Philippine films of the 1940s, List of Philippine films of the 1950s, List of Philippine films of the 1960s, List of Philippine films of the 1970s, List of Philippine films of the 1980s, List of Philippine films of the 1990s, List of Philippine films of the 2010s, List of Philippine submissions for the Academy Award for Best International Feature Film, List of highest-grossing films in the Philippines, List of people who won the Philippine movie grand slam, Lists of Philippine films, Lorna Tolentino, Philippines, Pops Fernandez, Young Critics Circle, 
Janice de Belen,3,Carmina Villarroel, Darna (2009 TV series), Gelli de Belen, 
Carlene Aguilar,5,Angelu de Leon, Carla Abellana, Geoff Eigenmann, Philippines, Precious Lara Quigaman, 
Catriona Grant,0,
Assunta De Rossi,42,Ai-Ai delas Alas, Alessandra De Rossi, Anita Linda, Anne Curtis, Ara Mina, Charito Solis, Cherry Pie Picache, Cindy Kurleto, Coney Reyes, Crazy Beautiful You, Dawn Zulueta, Diana Zubiri, Donita Rose, Elizabeth Oropesa, Eula Valdez, Gelli de Belen, Gina Alajar, Gina Pareño, Gloria Romero (actress), Hilda Koronel, Irma Adlawan, Jaclyn Jose, Jennylyn Mercado, Jessy Mendiola, Judy Ann Santos, Katrina Halili, Laurice Guillen, Liza Lorena, Lolita Rodriguez, Lorna Tolentino, Melanie Marquez, Mylene Dizon, Nadine Lustre, Nida Blanca, One More Try (film), Rosanna Roces, Sam Pinto, Sharon Cuneta, Sunshine Cruz, Vilma Santos, Vivian Velez, Zsa Zsa Padilla, 
Eda Nolan,23,Ai-Ai delas Alas, Anne Curtis, Brenna Garcia, Charee Pineda, Eula Valdez, Gladys Reyes, Gloria Diaz, Isabel Blaesi, Janelle Quintana, Janine Berdin, KC Concepcion, Kyline Alcantara, Maricel Laxa, Marla Boyd, Melissa Ricks, Michelle Madrigal, Paw Diaz, Philippines, Roxanne Guinoo, Ruffa Gutierrez, Sharlene San Pedro, Vina Morales, Xyriel Manabat, 
Jasmine Curtis-Smith,6,Anne Curtis, Eula Caballero, It's Showtime (Philippine TV program), Pamilya Roces, Philippines, Vina Morales, 
Maricel Laxa,26,Ai-Ai delas Alas, Anne Curtis, Brenna Garcia, Charee Pineda, Daddy's Gurl, Eda Nolan, Elizabeth Oropesa, Eula Valdez, Gladys Reyes, Gloria Diaz, Isabel Blaesi, Janelle Quintana, Janine Berdin, KC Concepcion, Kyline Alcantara, Marla Boyd, Melissa Ricks, Michelle Madrigal, Paw Diaz, Philippines, Roxanne Guinoo, Ruffa Gutierrez, Sharlene San Pedro, Sharon Cuneta, Vina Morales, Xyriel Manabat, 
Saab Magalona,5,Filipinos, Janine Gutierrez, Lauren Young, Maxene Magalona, Megan Young, 
Melissa Mendez,5,Empress Schuck, FAMAS Award, Isabel Rivas, One More Chance (2007 film), Philippines, 
Bea (given name),2,Bea Binene, Bea Nicolas, 
Naty Bernardo,0,
List of Taiwanese actresses,27,Ann Li, List of Afghans, List of Armenian actors, List of Azerbaijani actors, List of Bangladeshi actors, List of Bhutanese actors, List of Chinese actors, List of Chinese actresses, List of Filipino actresses, List of Filipino male actors, List of Indian film actresses, List of Iranian actresses, List of Iranian male actors, List of Israeli actors, List of Japanese actors, List of Jordanian actors, List of Malaysian actors, List of Nepalese actors, List of North Korean actors, List of Sri Lankan actors, List of Thai actresses, List of Thai male actors, List of Turkish actors, List of Uzbekistani film actors, List of Vietnamese actors, Lists of Indian actors, Lists of Philippine actors, 
Ai-Ai delas Alas,58,Aleck Bovick, Amalia Fuentes, Andi Eigenmann, Angelica Panganiban, Anita Linda, Anne Curtis, Ara Mina, Barbara Perez, Boots Anson-Roa, Brenna Garcia, Carmen Rosales, Celia Rodriguez, Charee Pineda, Charito Solis, Claudine Barretto, Daddy's Gurl, Dawn Zulueta, Dina Bonnevie, Eda Nolan, Elizabeth Oropesa, Eula Valdez, Filipinos, Gladys Reyes, Gloria Diaz, Gloria Romero (actress), Gloria Sevilla, Isabel Blaesi, Janelle Quintana, Janine Berdin, Janine Gutierrez, Judy Ann Santos, KC Concepcion, Kris Aquino, Kyline Alcantara, Lolita Rodriguez, Lorna Tolentino, Lovi Poe, Maricel Laxa, Marla Boyd, Marlene Daudén, Melissa Ricks, Michelle Madrigal, Nadine Lustre, Nena Cardenas, Nida Blanca, Paraluman, Paw Diaz, Perla Bautista, Rosa Rosal, Roxanne Guinoo, Ruffa Gutierrez, Sharlene San Pedro, Sharon Cuneta, Snooky Serna, Vilma Santos, Vina Morales, Vivian Velez, Xyriel Manabat, 
Elizabeth Ramsey,3,Filipinos, Jaya (singer), Philippines, 
Gem Ramos,0,
Krista Ranillo,1,Philippines, 
Nicole Uysiuseng,41,Aleck Bovick, Ann Li, Barbie Imperial, Bea Saw, Beauty Gonzalez, Cassandra Ponti, Dionne Monsanto, Elisse Joson, Fretzie Bercede, Gaby Dela Merced, Gee-Ann Abrahan, Gerald Anderson, Heaven Peralejo, Jane Oineza, Jinri Park, Kaori Oinuma, Kisses Delavin, Maymay Entrata, Megan Young, Melai Cantiveros, Mich Dulce, Miho Nishida, Myrtle Sarrosa, Nene Tamayo, Niña Jose, Philippines, Pinoy Big Brother: Otso, Pinoy Big Brother: Season 1, Pinoy Big Brother: Season 2, Pinoy Big Brother: Teen Clash 2010, Riza Santos, Roxanne Barcelo, Sam Pinto, Seth Fedelin, Valerie Weigmann, Vickie Rushton, Vivoree Esclito, Wendy Valdez, Yayo Aguila, Yen Santos, Ylona Garcia, 
Luz Valdez,1,Eugene Domingo, 
List of Iranian male actors,26,List of Afghans, List of Armenian actors, List of Azerbaijani actors, List of Bangladeshi actors, List of Bhutanese actors, List of Chinese actors, List of Chinese actresses, List of Filipino actresses, List of Filipino male actors, List of Indian film actresses, List of Iranian actresses, List of Israeli actors, List of Japanese actors, List of Jordanian actors, List of Malaysian actors, List of Nepalese actors, List of North Korean actors, List of Sri Lankan actors, List of Taiwanese actresses, List of Thai actresses, List of Thai male actors, List of Turkish actors, List of Uzbekistani film actors, List of Vietnamese actors, Lists of Indian actors, Lists of Philippine actors, 
Boots Anson-Roa,38,Ai-Ai delas Alas, Aleck Bovick, Amalia Fuentes, Andi Eigenmann, Angelica Panganiban, Anita Linda, Anne Curtis, Ara Mina, Barbara Perez, Carmen Rosales, Celia Rodriguez, Charito Solis, Claudine Barretto, Dawn Zulueta, Dina Bonnevie, Elizabeth Oropesa, Fernando Poe Jr., Filipinos, Gloria Romero (actress), Gloria Sevilla, Hanggang sa Dulo ng Buhay Ko, Janine Gutierrez, Judy Ann Santos, KC Concepcion, Lolita Rodriguez, Lorna Tolentino, Lovi Poe, Marlene Daudén, Nadine Lustre, Nena Cardenas, Nida Blanca, Paraluman, Perla Bautista, Rosa Rosal, Sharon Cuneta, Snooky Serna, Vilma Santos, Vivian Velez, 
Michelle van Eimeren,3,Charlene Gonzales, Philippines, Regine Velasquez, 
Rica Peralejo,5,FAMAS Award, Heaven Peralejo, It's Showtime (Philippine TV program), Paula Peralejo, Philippines, 
Donita Rose,12,Alessandra De Rossi, Assunta De Rossi, Cindy Kurleto, Diana Zubiri, Gladys Reyes, Jennylyn Mercado, Jessy Mendiola, Katrina Halili, Nadine Lustre, Philippines, Sam Pinto, Sunshine Cruz, 
Artista Academy,6,Boots Anson-Roa, Gelli de Belen, Lorna Tolentino, Shaira Diaz, Sophie Albert, Valeen Montenegro, 
Caridad Sanchez,2,Darna (2009 TV series), Filipinos, 
Manilyn Reynes,24,Ai-Ai delas Alas, Anne Curtis, Ara Mina, Assunta De Rossi, Charito Solis, Coney Reyes, Dawn Zulueta, Elizabeth Oropesa, Gina Alajar, Gloria Romero (actress), Hilda Koronel, Irma Adlawan, Jennylyn Mercado, Judy Ann Santos, Laurice Guillen, Liza Lorena, Lolita Rodriguez, Melanie Marquez, One More Try (film), Sharon Cuneta, Sheryl Cruz, Vilma Santos, Vivian Velez, Zsa Zsa Padilla, 
Elizabeth Cooper,2,Cinema of the Philippines, Philippines, 
List of Armenian actors,26,List of Afghans, List of Azerbaijani actors, List of Bangladeshi actors, List of Bhutanese actors, List of Chinese actors, List of Chinese actresses, List of Filipino actresses, List of Filipino male actors, List of Indian film actresses, List of Iranian actresses, List of Iranian male actors, List of Israeli actors, List of Japanese actors, List of Jordanian actors, List of Malaysian actors, List of Nepalese actors, List of North Korean actors, List of Sri Lankan actors, List of Taiwanese actresses, List of Thai actresses, List of Thai male actors, List of Turkish actors, List of Uzbekistani film actors, List of Vietnamese actors, Lists of Indian actors, Lists of Philippine actors, 
Harlene Bautista,8,Alma Moreno, FAMAS Award, Fernando Poe Jr., Jennifer Sevilla, Lorna Tolentino, Nanette Medved, Philippines, Vina Morales, 
Madam Auring,1,Fernando Poe Jr., 
Jessy Mendiola,19,Assunta De Rossi, Cindy Kurleto, Dawn Zulueta, Diana Zubiri, Donita Rose, Empress Schuck, Filipinos, Gerald Anderson, It's Showtime (Philippine TV program), Jennylyn Mercado, Jewel Mische, Katrina Halili, Megan Young, Melai Cantiveros, Nadine Lustre, Philippines, Sam Pinto, Sunshine Cruz, Xian Lim, 
List of Philippine films of 2020,47,1984 in the Philippines, 2020 in film, Ai-Ai delas Alas, Alessandra De Rossi, Alex Gonzaga, Alexa Ilacad, Angelica Panganiban, Barbie Imperial, Belle Mariano, Cinema of the Philippines, Dennis Padilla, Dimples Romana, Ina Raymundo, Ivana Alawi, Jane Oineza, Jasmine Curtis-Smith, Kisses Delavin, Kylie Verzosa, List of Philippine films before 1940, List of Philippine films of 2011, List of Philippine films of 2012, List of Philippine films of 2013, List of Philippine films of 2014, List of Philippine films of 2015, List of Philippine films of 2016, List of Philippine films of 2017, List of Philippine films of 2018, List of Philippine films of 2019, List of Philippine films of the 1940s, List of Philippine films of the 1950s, List of Philippine films of the 1960s, List of Philippine films of the 1970s, List of Philippine films of the 1980s, List of Philippine films of the 1990s, List of Philippine films of the 2010s, Lists of Philippine films, Lovi Poe, Mara Lopez, Michael de Mesa, Miles Ocampo, Music of the Philippines, Myrtle Sarrosa, Ritz Azul, Shaina Magdayao, Sue Ramirez, Sylvia Sanchez, Xian Lim, 
List of Philippine co-produced films and television series,19,Cinema of the Philippines, FAMAS Award, Gawad Urian Award, Laurice Guillen, List of Philippine films before 1940, List of Philippine films of the 1940s, List of Philippine films of the 1950s, List of Philippine films of the 1960s, List of Philippine films of the 1970s, List of Philippine films of the 1980s, List of Philippine films of the 1990s, List of Philippine films of the 2010s, List of Philippine submissions for the Academy Award for Best International Feature Film, List of highest-grossing films in the Philippines, List of people who won the Philippine movie grand slam, Lists of Philippine films, Luna Award, Philippines, Young Critics Circle, 
If U Seek Amy,0,
Rufa Mi,2,Philippines, Rufa Mae Quinto, 
List of Halik episodes,2,Halik (TV series), Yen Santos, 
Lady Lee,3,FAMAS Award, Kris Aquino, Philippines, 
Matet de Leon,6,Huwag Kang Mangamba, Janine Gutierrez, Lilia Dizon, Lotlot de Leon, Nang Ngumiti ang Langit, Pangako Sa 'Yo (2015 TV series), 
Andrea Torres,7,Hazel Ann Mendoza, Isabel Blaesi, Karel Marquez, Megan Young, Paw Diaz, Philippines, Tanya Garcia, 
Jana Roxas,4,Aljur Abrenica, Iwa Moto, Jackie Rice, Jennylyn Mercado, 
Carmi Martin,6,Anna Marie Gutierrez, Four Sisters and a Wedding, Liz Alindogan, No Other Woman, Philippines, Working Girls (2010 film), 
Sabrina Man,1,Darna (2009 TV series), 
Gladys Reyes,27,Ai-Ai delas Alas, Anne Curtis, Brenna Garcia, Charee Pineda, Daddy's Gurl, Eda Nolan, Eula Valdez, Filipinos, Gawad Urian Award, Gloria Diaz, Isabel Blaesi, Janelle Quintana, Janine Berdin, Julia Montes, KC Concepcion, Kyline Alcantara, Maricel Laxa, Marla Boyd, Melissa Ricks, Michelle Madrigal, Paw Diaz, Philippines, Roxanne Guinoo, Ruffa Gutierrez, Sharlene San Pedro, Vina Morales, Xyriel Manabat, 
Jef Gaitan,7,Aiko Climaco, Empress Schuck, Halik (TV series), Philippines, Phoemela Baranda, Wendy Valdez, Working Girls (2010 film), 
Anita Linda,51,Ai-Ai delas Alas, Aleck Bovick, Amalia Fuentes, Andi Eigenmann, Angelica Panganiban, Anita Linda, Anne Curtis, Ara Mina, Assunta De Rossi, Barbara Perez, Boots Anson-Roa, Carla Abellana, Carmen Rosales, Celia Rodriguez, Charito Solis, Cherry Pie Picache, Claudine Barretto, Dawn Zulueta, Diana Zubiri, Dina Bonnevie, Elizabeth Oropesa, Eula Valdez, FAMAS Award, Gelli de Belen, Gina Alajar, Gina Pareño, Gloria Romero (actress), Gloria Sevilla, Jaclyn Jose, Janice de Belen, Janine Gutierrez, Judy Ann Santos, KC Concepcion, Lolita Rodriguez, Lorna Tolentino, Lovi Poe, Marlene Daudén, Mylene Dizon, Nadine Lustre, Nena Cardenas, Nida Blanca, Paraluman, Perla Bautista, Rosa Rosal, Rosanna Roces, Sharon Cuneta, Snooky Serna, Vilma Santos, Vivian Velez, Young Critics Circle, Zsa Zsa Padilla, 
Gina Alajar,42,Ai-Ai delas Alas, Anita Linda, Anne Curtis, Ara Mina, Assunta De Rossi, Charito Solis, Cherry Pie Picache, Coney Reyes, Dawn Zulueta, Elizabeth Oropesa, Elle Ramirez, Eula Valdez, FAMAS Award, Gawad Urian Award, Gelli de Belen, Geoff Eigenmann, Gina Pareño, Gloria Romero (actress), Hilda Koronel, Irma Adlawan, Jaclyn Jose, Jennylyn Mercado, Judy Ann Santos, Krizza Neri, Laurice Guillen, Liza Lorena, Lolita Rodriguez, Lorna Tolentino, Melanie Marquez, Michael de Mesa, Mylene Dizon, Nadine Lustre, Nida Blanca, One More Try (film), Rosanna Roces, Sharon Cuneta, StarStruck (season 5), Temptation of Wife (2012 TV series), Thea Tolentino, Vilma Santos, Vivian Velez, Zsa Zsa Padilla, 
Denise Joaquin,3,Jodi Sta. Maria, One More Chance (2007 film), Philippines, 
Precious Lara Quigaman,7,Gloria Diaz, Halik (TV series), It's Showtime (Philippine TV program), Kylie Verzosa, Megan Young, Melanie Marquez, Philippines, 
Rufa Mae Quinto,9,Bangs Garcia, Daddy's Gurl, Darna (2009 TV series), FAMAS Award, It's Showtime (Philippine TV program), Jean Garcia, Jennica Garcia, Jinri Park, Rufa Mi, 
Jaymee Joaquin,1,Philippines, 
Cielito del Mundo,0,
Chlaui Malayao,1,Philippines, 
Rebecca Lusterio,1,Filipinos, 
Kuh Ledesma,5,Jaya (singer), Music of the Philippines, Pops Fernandez, Regine Velasquez, Zsa Zsa Padilla, 
Lyca Gairanod,14,Elha Nympha, Emmanuelle Vera, Esang de Torres, Filipinos, It's Showtime (Philippine TV program), Karla Estrada, Lea Salonga, Lougee Basabas, Moira Dela Torre, Regine Velasquez, Rufa Mi, Sarah Geronimo, Sharon Cuneta, Zephanie Dimaranan, 
Mary Jean Lastimosa,15,Ariella Arida, Bianca Manalo, Charlene Gonzales, Filipinos, Gloria Diaz, Janine Tugonon, Joanne Santos-Quintas, Maria Isabel Lopez, Maxine Medina, Miriam Quiambao, Philippines, Rabiya Mateo, Rosario Silayan-Bailon, Shamcey Supsup-Lee, Venus Raj, 
Sophia Montecarlo,7,Lani Misalucha, Lea Salonga, Megan Young, Philippines, Sugar Mercado, Vilma Santos, Zsa Zsa Padilla, 
Dawn Zulueta,42,Ai-Ai delas Alas, Aleck Bovick, Amalia Fuentes, Andi Eigenmann, Angelica Panganiban, Anita Linda, Anne Curtis, Ara Mina, Barbara Perez, Boots Anson-Roa, Carmen Rosales, Celia Rodriguez, Charito Solis, Charlene Gonzales, Claudine Barretto, Dina Bonnevie, Elizabeth Oropesa, FAMAS Award, Gloria Romero (actress), Gloria Sevilla, Jaclyn Jose, Janine Gutierrez, Judy Ann Santos, Julia Montes, KC Concepcion, Lolita Rodriguez, Lorna Tolentino, Lovi Poe, Luna Award, Marlene Daudén, Nadine Lustre, Nena Cardenas, Nida Blanca, Paraluman, Perla Bautista, Philippines, Rosa Rosal, Sharon Cuneta, Sheryl Cruz, Snooky Serna, Vilma Santos, Vivian Velez, 
Princess Guevarra,1,Philippines, 
Anja Aguilar,3,Nadine Lustre, Sarah Geronimo, Shy Carlos, 
List of Philippine films of the 1940s,53,1984 in the Philippines, Anita Linda, Aruray, Bella Flores, Carmen Rosales, Chicháy, Cinema of the Philippines, Dely Atay-Atayan, Etang Discher, FAMAS Award, Gawad Urian Award, Justina David, Katy de la Cruz, Lilia Dizon, Linda Estrella, List of Philippine co-produced films and television series, List of Philippine films before 1940, List of Philippine films of 2011, List of Philippine films of 2012, List of Philippine films of 2013, List of Philippine films of 2014, List of Philippine films of 2015, List of Philippine films of 2016, List of Philippine films of 2017, List of Philippine films of 2018, List of Philippine films of 2019, List of Philippine films of 2020, List of Philippine films of the 1950s, List of Philippine films of the 1960s, List of Philippine films of the 1970s, List of Philippine films of the 1980s, List of Philippine films of the 1990s, List of Philippine films of the 2010s, List of Philippine submissions for the Academy Award for Best International Feature Film, List of highest-grossing films in the Philippines, List of people who won the Philippine movie grand slam, Lists of Philippine films, Lota Delgado, Luna Award, Mary Walter, Mila del Sol, Music of the Philippines, Naty Bernardo, Nela Álvarez, Nena Cardenas, Pacita del Río, Paraluman, Philippines, Rosa Mia, Rosa Rosal, Rosa del Rosario, Sylvia La Torre, Young Critics Circle, 
Athena Tibi,5,Lea Salonga, Nikki Bacolod, Philippines, Regine Velasquez, Sarah Geronimo, 
Hanggang sa Dulo ng Buhay Ko,8,Analyn Barro, Boots Anson-Roa, Denise Barbacena, Francine Prieto, Julie Anne San Jose, Megan Young, Patricia Tumulak, Sharmaine Arnaiz, 
My Girl (film),0,
Bing Loyzaga,2,Babaeng Hampaslupa, Filipinos, 
Sandy Andolong,4,Filipinos, Lotlot de Leon, Matet de Leon, Philippines, 
Maricar Reyes,4,Filipinos, Gloria Sevilla, Lilia Cuntapay, Philippines, 
Donna Cruz,15,Ana Roces, Angelu de Leon, Candy Pangilinan, Charito Solis, Dimples Romana, Hilda Koronel, Manilyn Reynes, Music of the Philippines, Nanette Medved, Nida Blanca, Nikki Valdez, Philippines, Rebecca Lusterio, Regine Velasquez, Vina Morales, 
Vivian Velez,41,Ai-Ai delas Alas, Aleck Bovick, Amalia Fuentes, Andi Eigenmann, Angelica Panganiban, Anita Linda, Anne Curtis, Ara Mina, Barbara Perez, Boots Anson-Roa, Carmen Rosales, Celia Rodriguez, Charito Solis, Claudine Barretto, Dawn Zulueta, Dina Bonnevie, Elizabeth Oropesa, FAMAS Award, Filipinos, Gawad Urian Award, Gloria Romero (actress), Gloria Sevilla, Janine Gutierrez, Jessy Mendiola, Judy Ann Santos, KC Concepcion, Lolita Rodriguez, Lorna Tolentino, Lovi Poe, Marlene Daudén, Michael de Mesa, Nadine Lustre, Nena Cardenas, Nida Blanca, Paraluman, Perla Bautista, Philippines, Rosa Rosal, Sharon Cuneta, Snooky Serna, Vilma Santos, 
Carla Abellana,6,Elle Ramirez, Filipinos, Krizza Neri, Pamilya Roces, Thea Tolentino, Young Critics Circle, 
Verna Gaston,0,
List of Bhutanese actors,26,List of Afghans, List of Armenian actors, List of Azerbaijani actors, List of Bangladeshi actors, List of Chinese actors, List of Chinese actresses, List of Filipino actresses, List of Filipino male actors, List of Indian film actresses, List of Iranian actresses, List of Iranian male actors, List of Israeli actors, List of Japanese actors, List of Jordanian actors, List of Malaysian actors, List of Nepalese actors, List of North Korean actors, List of Sri Lankan actors, List of Taiwanese actresses, List of Thai actresses, List of Thai male actors, List of Turkish actors, List of Uzbekistani film actors, List of Vietnamese actors, Lists of Indian actors, Lists of Philippine actors, 
Raquel Monteza,4,Alma Moreno, Arci Muñoz, Sharon Cuneta, Tanya Garcia, 
Bea Nicolas,1,Philippines, 
Anna Marie Gutierrez,12,Boots Anson-Roa, Carmi Martin, Celia Rodriguez, Gawad Urian Award, Gina Alajar, Gloria Romero (actress), Isabel Rivas, Liz Alindogan, Maria Isabel Lopez, Michael de Mesa, Nida Blanca, Pia Moran, 
Rabiya Mateo,15,Ariella Arida, Bianca Manalo, Charlene Gonzales, Filipinos, Gloria Diaz, Janine Tugonon, Joanne Santos-Quintas, Maria Isabel Lopez, Mary Jean Lastimosa, Maxine Medina, Miriam Quiambao, Philippines, Rosario Silayan-Bailon, Shamcey Supsup-Lee, Venus Raj, 
Elaine Duran,5,It's Showtime (Philippine TV program), Janine Berdin, Nina Girado, Philippines, Tawag ng Tanghalan, 
Ylona Garcia,50,Aleck Bovick, Alexa Ilacad, Ann Li, Barbie Imperial, Bea Saw, Beauty Gonzalez, Cassandra Ponti, Dionne Monsanto, Elisse Joson, Fretzie Bercede, Gaby Dela Merced, Gee-Ann Abrahan, Gerald Anderson, Heaven Peralejo, It's Showtime (Philippine TV program), Jane Oineza, Janella Salvador, Jinri Park, Kaori Oinuma, Kisses Delavin, Liza Soberano, Maymay Entrata, Megan Young, Melai Cantiveros, Mich Dulce, Miho Nishida, Music of the Philippines, Myrtle Sarrosa, Nadine Lustre, Nene Tamayo, Nicole Uysiuseng, Niña Jose, On the Wings of Love (TV series), Pinoy Big Brother: Otso, Pinoy Big Brother: Season 1, Pinoy Big Brother: Season 2, Pinoy Big Brother: Teen Clash 2010, Riza Santos, Roxanne Barcelo, Sam Pinto, Sarah Geronimo, Seth Fedelin, Sharlene San Pedro, Sue Ramirez, Valerie Weigmann, Vickie Rushton, Vivoree Esclito, Wendy Valdez, Yayo Aguila, Yen Santos, 
Morissette (singer),25,Alex Gonzaga, Angeline Quinto, Crazy Beautiful You, Elha Nympha, Ellen Adarna, Emmanuelle Vera, Esang de Torres, Eula Caballero, It's Showtime (Philippine TV program), KZ Tandingan, Karla Estrada, Karylle, Lani Misalucha, Lea Salonga, Lougee Basabas, Lyca Gairanod, Moira Dela Torre, Nina Girado, Philippines, Regine Velasquez, Rufa Mi, Sarah Geronimo, Vilma Santos, Xian Lim, Zephanie Dimaranan, 
Rosario Silayan-Bailon,14,Ariella Arida, Bianca Manalo, Charlene Gonzales, Gloria Diaz, Janine Tugonon, Joanne Santos-Quintas, Maria Isabel Lopez, Mary Jean Lastimosa, Maxine Medina, Miriam Quiambao, Philippines, Rabiya Mateo, Shamcey Supsup-Lee, Venus Raj, 
Regine Tolentino,0,
Frencheska Farr,4,Aicelle Santos, Jaya (singer), Julie Anne San Jose, Philippines, 
Mercedes Cabral,2,Huwag Kang Mangamba, Philippines, 
Sunshine Dizon,6,Angelika Dela Cruz, Daddy's Gurl, It's Showtime (Philippine TV program), Janine Gutierrez, Katrina Halili, Regine Velasquez, 
List of Filipino current child actors,9,Barbara Miguel, Brenna Garcia, Jillian Ward, Lyca Gairanod, Mona Louise Rey, Mutya Orquia, Philippines, Ryzza Mae Dizon, Xyriel Manabat, 
Jane De Leon,5,AC Bonifacio, Halik (TV series), It's Showtime (Philippine TV program), Liza Soberano, Ylona Garcia, 
List of Running Man episodes (2017),0,
Roselle Nava,6,Antoinette Taus, Carol Banawa, Claudine Barretto, Filipinos, Jolina Magdangal, Nikki Valdez, 
Donna Villa,2,Alma Moreno, Gloria Romero (actress), 
Heaven Peralejo,42,Aleck Bovick, Ann Li, Barbie Imperial, Bea Saw, Beauty Gonzalez, Cassandra Ponti, Dionne Monsanto, Elisse Joson, Fretzie Bercede, Gaby Dela Merced, Gee-Ann Abrahan, Gerald Anderson, Jane Oineza, Jinri Park, Kaori Oinuma, Kisses Delavin, Maymay Entrata, Megan Young, Melai Cantiveros, Mich Dulce, Miho Nishida, Myrtle Sarrosa, Nene Tamayo, Nicole Uysiuseng, Niña Jose, Paula Peralejo, Pinoy Big Brother: Otso, Pinoy Big Brother: Season 1, Pinoy Big Brother: Season 2, Pinoy Big Brother: Teen Clash 2010, Rica Peralejo, Riza Santos, Roxanne Barcelo, Sam Pinto, Seth Fedelin, Valerie Weigmann, Vickie Rushton, Vivoree Esclito, Wendy Valdez, Yayo Aguila, Yen Santos, Ylona Garcia, 
Venus Raj,15,Ariella Arida, Bianca Manalo, Charlene Gonzales, Gloria Diaz, Janine Tugonon, January Isaac, Joanne Santos-Quintas, Maria Isabel Lopez, Mary Jean Lastimosa, Maxine Medina, Miriam Quiambao, Philippines, Rabiya Mateo, Rosario Silayan-Bailon, Shamcey Supsup-Lee, 
Ruby Moreno,1,Philippines, 
Radha Cuadrado,12,Elha Nympha, Emmanuelle Vera, Esang de Torres, Karla Estrada, Lea Salonga, Lougee Basabas, Lyca Gairanod, Moira Dela Torre, Philippines, Rufa Mi, Sarah Geronimo, Zephanie Dimaranan, 
Esang de Torres,16,Elha Nympha, Elizabeth Ramsey, Emmanuelle Vera, It's Showtime (Philippine TV program), Jake Zyrus, Jaya (singer), Karla Estrada, Kuh Ledesma, Lea Salonga, Lougee Basabas, Lyca Gairanod, Moira Dela Torre, Rufa Mi, Sarah Geronimo, Zephanie Dimaranan, Zsa Zsa Padilla, 
